Movie Title,Critic Score,Audience Score,Synopsis,Cast,Director,Producer,Screenwriter,Distributor,Production Co,Rating,Genre,Original Language,Release Date (Streaming),Runtime,Sound Mix,Aspect Ratio Flat,Release Date (Theaters),Box Office (Gross USA),Aspect Ratio Digital,Aspect Ratio Scope,Rerelease Date (Theaters),Aspect Ratio Academy,Aspect Ratio 16mm,Creator,Aspect Ratio 35mm,Aspect Ratio 70mm,Release Date (DVD)
The Gorge,63%,76%,"Two highly-trained operatives (Miles Teller and Anya Taylor-Joy) are appointed to posts in guard towers on opposite sides of a vast and highly classified gorge, protecting the world from an undisclosed, mysterious evil that lurks within. They bond from a distance while trying to stay vigilant in defending against an unseen enemy. When the cataclysmic threat to humanity is revealed to them, they must work together in a test of both their physical and mental strength to keep the secret in the gorge before it's too late.","Miles Teller, Anya Taylor-Joy, Sigourney Weaver, Sope Dirisu, William Houston",Scott Derrickson,"Scott Derrickson , Zach Dean , David Ellison , Dana Goldberg , Don Granger , C. Robert Cargill , Sherryl Clark , Adam Kolbrenner , Gregory Goodman","Zach Dean , Zach Dean",Apple TV+,"Skydance Media , Crooked Highway",PG-13 (Intense Sequences of Violence|Brief Strong Language|Action|Some Suggestive Material|Thematic Elements),"Mystery & Thriller , Action , Adventure , Horror , Romance",English,"Feb 14, 2025",2h 7m,Dolby Digital,(1.85:1),,,,,,,,,,,
Wolfs,67%,72%,"Global superstars George Clooney and Brad Pitt team up for the action comedy Wolfs. Clooney plays a professional fixer hired to cover up a high profile crime. But when a second fixer (Pitt) shows up and the two ""lone wolves"" are forced to work together, they find their night spiraling out of control in ways that neither one of them expected.","George Clooney, Brad Pitt, Amy Ryan, Austin Abrams, Poorna Jagannathan",Jon Watts,"Grant Heslov , George Clooney , Brad Pitt , Dede Gardner , Jeremy Kleiner , Jon Watts , Dianne McGunigle",Jon Watts,Columbia Pictures,"Smokehouse Pictures , Apple Original Films , Freshman Year , Plan B Entertainment",R (Some Violent Content|Language Throughout),"Action , Comedy",English,"Sep 27, 2024",1h 48m,Dolby Atmos,,"Sep 20, 2024, Limited",,2.39:1,,,,,,,,
Downwind,100%,77%,"Hiroshima. Nagasaki. Mercury, Nevada? The latter was the site for the testing of 928 nuclear weapons on American soil from 1951 to 1992. The fallout is still lethally impacting Americans today. Martin Sheen narrates this harrowing exposé of the United States' disregard for everyone living... downwind.","Martin Sheen, Lewis Black, Michael Douglas, Patrick Wayne","Mark Shapiro , Douglas Brian Miller","Mark Shapiro , Warren Pereira","Warren Etheredge , Mark Shapiro",Gravitas Ventures,"Backlot Docs , Cinco Dedos Peliculas",,"Documentary , History",English,"Aug 18, 2023",1h 34m,,,"Aug 18, 2023, Limited",,,,,,,,,,
Killers of the Flower Moon,93%,84%,"Based on David Grann's broadly lauded best-selling book, ""Killers of the Flower Moon"" is set in 1920s Oklahoma and depicts the serial murder of members of the oil-wealthy Osage Nation, a string of brutal crimes that came to be known as the Reign of Terror.","Leonardo DiCaprio, Robert De Niro, Jesse Plemons, Lily Gladstone, Tantoo Cardinal",Martin Scorsese,"Martin Scorsese , Dan Friedkin , Bradley Thomas , Daniel Lupi","Eric Roth , Martin Scorsese",Paramount Pictures,"Appian Way , Apple Studios , Sikelia Productions , Imperative Entertainment",R (Some Grisly Images|Language|Violence),"Crime , Drama",English,"Dec 5, 2023",3h 26m,"Dolby Atmos , Dolby Digital",,"Oct 20, 2023, Wide",$68.0M,2.39:1,,,,,,,,
Fly Me to the Moon,65%,89%,"Starring Scarlett Johansson and Channing Tatum, Fly Me To The Moon is a sharp, stylish romantic comedy set against the high-stakes backdrop of NASA's historic Apollo 11 moon landing. Brought in to fix NASA's public image, sparks fly in all directions as marketing maven Kelly Jones (Johansson) wreaks havoc on launch director Cole Davis's (Tatum) already difficult task. When the White House deems the mission too important to fail, the countdown truly begins....","Scarlett Johansson, Channing Tatum, Jim Rash, Anna Garcia, Ray Romano",Greg Berlanti,"Jonathan Lia , Scarlett Johansson , Keenan Flynn , Sarah Schechter",Rose Gilroy,Columbia Pictures,Apple Original Films,PG-13 (Some Strong Language|Smoking),"Romance , Comedy , Drama , History",English,"Aug 13, 2024",2h 12m,,,"Jul 12, 2024, Wide",$20.3M,2.39:1,,,,,,,,
The Instigators,41%,55%,"Rory (Matt Damon) and Cobby (Casey Affleck) are reluctant partners: a desperate father and an ex-con thrown together to rob a corrupt politician's ill-gained earnings. But when the heist goes wrong, the two find themselves engulfed in a whirlwind of chaos, pursued not only by police but also by backward bureaucrats and vengeful crime bosses. Completely out of their depth, they convince Rory's therapist (Hong Chau) to join their riotous getaway through the city, where they must put aside their differences and work together to evade capture -- or worse.","Matt Damon, Casey Affleck, Hong Chau, Michael Stuhlbarg, Paul Walter Hauser",Doug Liman,"Matt Damon , Ben Affleck , Jeff Robinov , John Graham , Kevin J. Walsh",Chuck MacLean,Apple TV+,"Apple TV+ , The Walsh Company , Apple Original Films , Studio 8 , Artists Equity , Apple Studios",R (Some Violence|Pervasive Language),"Action , Comedy , Mystery & Thriller , Crime",English,"Aug 9, 2024",1h 41m,,,"Aug 2, 2024, Limited",,,,,,,,,,
Blitz,81%,81%,"Sir Steve McQueen's ""Blitz"" follows the epic journey of George (Elliott Heffernan), a 9-year-old boy in World War II London whose mother Rita (Saoirse Ronan) sends him to safety in the English countryside. George, defiant and determined to return home to his mom and his grandfather Gerald (Paul Weller) in East London, embarks on an adventure, only to find himself in immense peril, while a distraught Rita searches for her missing son.","Saoirse Ronan, Elliott Heffernan, Leigh Gill, Harris Dickinson, Erin Kellyman",Steve McQueen,"Tim Bevan , Eric Fellner , Steve McQueen , Arnon Milchan , Yariv Milchan , Anita Overland",Steve McQueen,Apple Original Films,"Working Title Films , Apple Studios , New Regency Productions , Lammas Park",PG-13,"History , Drama , War",British English,"Nov 22, 2024",2h 0m,"Dolby Atmos , Dolby Digital",,"Nov 1, 2024, Limited",,2.39:1,,,,,,,,
Greyhound,78%,76%,"U.S. Navy Cmdr. Ernest Krause is assigned to lead an Allied convoy across the Atlantic during World War II. His convoy, however, is pursued by German U-boats. Although this is Krause's first wartime mission, he finds himself embroiled in what would come to be known as the longest, largest and most complex naval battle in history: The Battle of the Atlantic.","Tom Hanks, Stephen Graham, Elisabeth Shue, Rob Morgan, Josh Wiggins",Aaron Schneider,Gary Goetzman,Tom Hanks,,"Creative Wealth Media Finance , Zhengfu Pictures , FilmNation Entertainment , Sycamore Pictures , Stage 6 Films , Playtone , Columbia Pictures , BRON Studios , Creative Artists Agency",PG-13 (War Related Action/Violence|Brief Strong Language),"War , History , Drama",English,"Jul 10, 2020",1h 32m,Stereo,,,,,(2.35:1),,,,,,,
Napoleon,58%,58%,"""Napoleon"" is a spectacle-filled action epic that details the checkered rise and fall of the iconic French Emperor Napoleon Bonaparte, played by Oscar winner Joaquin Phoenix. Against a stunning backdrop of large-scale filmmaking orchestrated by legendary director Ridley Scott, the film captures Bonaparte's relentless journey to power through the prism of his addictive, volatile relationship with his one true love, Josephine, showcasing his visionary military and political tactics against some of the most dynamic practical battle sequences ever filmed.","Joaquin Phoenix, Vanessa Kirby, Ben Miles, Tahar Rahim, Ludivine Sagnier",Ridley Scott,"Mark Huffam , Ridley Scott , Kevin J. Walsh",David Scarpa,Apple Original Films / Columbia Pictures,Scott Free Productions,R (Sexual Content|Brief Language|Some Grisly Images|Strong Violence),"Biography , History , Drama , War , Action",English,"Jan 9, 2024",2h 38m,"Dolby Atmos , Dolby Digital",,"Nov 22, 2023, Wide",$61.2M,2.39:1,,,,,,,,
Argylle,33%,70%,"Bryce Dallas Howard (Jurassic World franchise) is Elly Conway, the reclusive author of a series of best-selling espionage novels, whose idea of bliss is a night at home with her computer and her cat, Alfie. But when the plots of Elly's fictional books--which center on secret agent Argylle and his mission to unravel a global spy syndicate--begin to mirror the covert actions of a real-life spy organization, quiet evenings at home become a thing of the past. Accompanied by Aidan (Oscar® winner Sam Rockwell), a cat-allergic spy, Elly (carrying Alfie in her backpack) races across the world to stay one step ahead of the killers as the line between Elly's fictional world and her real one begins to blur.","Bryce Dallas Howard, Sam Rockwell, Henry Cavill, John Cena, Dua Lipa",Matthew Vaughn,"Matthew Vaughn , Adam Bohling , David Reid , Jason Fuchs",Jason Fuchs,Universal Pictures,Cloudy,PG-13 (Strong Violence and Action|Some Strong Language),"Action , Adventure , Comedy , Drama , Mystery & Thriller",English,"Mar 5, 2024",2h 19m,"Dolby Digital , Dolby Atmos",,"Feb 2, 2024, Wide",$45.2M,2.39:1,,,,,,,,
Ghosted,25%,55%,"Salt-of-the-earth Cole (Chris Evans) falls head over heels for enigmatic Sadie (Ana de Armas)--but then makes the shocking discovery that she's a secret agent. Before they can decide on a second date, Cole and Sadie are swept away on an international adventure to save the world.","Chris Evans, Ana De Armas, Adrien Brody, Mike Moh, Amy Sedaris",Dexter Fletcher,"Jules Daly , David Ellison , Chris Evans , Dana Goldberg , Don Granger , Rhett Reese , Paul Wernick","Chris McKenna , Rhett Reese , Paul Wernick , Erik Sommers",Apple TV+,"Apple Original Films , Studio Concierge , Skydance Media",PG-13 (Brief Strong Language|Some Sexual Content|Seq. of Strong violence/Action),"Action , Romance , Adventure",English,"Apr 21, 2023",1h 56m,,,,,,,,,,,,,
CODA,94%,91%,"Seventeen-year-old Ruby (Emilia Jones) is the sole hearing member of a deaf family -- a CODA, child of deaf adults. Her life revolves around acting as interpreter for her parents (Marlee Matlin, Troy Kotsur) and working on the family's struggling fishing boat every day before school with her father and older brother (Daniel Durant). But when Ruby joins her high school's choir club, she discovers a gift for singing and soon finds herself drawn to her duet partner Miles (Ferdia Walsh-Peelo). Encouraged by her enthusiastic, tough-love choirmaster (Eugenio Derbez) to apply to a prestigious music school, Ruby finds herself torn between the obligations she feels to her family and the pursuit of her own dreams.","Emilia Jones, Troy Kotsur, Marlee Matlin, Eugenio Derbez, Daniel Durant",Sian Heder,"Philippe Rousselet , Fabrice Gianfermi , Patrick Wachsberger , Jérôme Seydoux",Sian Heder,Apple TV+,"Apple Original Films , Vendome Pictures , Picture Perfect Federation , Pathé Films",PG-13 (Strong Sexual Content|Language|Drug Use),Drama,English,"Aug 13, 2021",1h 51m,,(1.85:1),"Aug 13, 2021, Limited",,,,"Apr 1, 2022",,,,,,
Sharper,68%,73%,"Motivations are suspected and expectations are turned upside down, as a con artist takes on Manhattan billionaires.","Julianne Moore, Sebastian Stan, Justice Smith, Briana Middleton, John Lithgow",Benjamin Caron,"Erik Feig , Bart Freundlich , Brian Gatewood , Julianne Moore , Jessica Switch , Alessandro Tanaka","Brian Gatewood , Alessandro Tanaka",Apple Original Films / A24,"A24 , Picturestart , Apple Original Films",R (Language Throughout|Some Sexual References),Drama,English,"Feb 17, 2023",1h 56m,,,"Feb 10, 2023, Limited",,,,,,,,,,
Tetris,81%,88%,"""Tetris"" tells the unbelievable story of how one of the world's most popular video games found its way to avid players around the globe. Henk Rogers (Taron Egerton) discovers TETRIS in 1988, and then risks everything by traveling to the Soviet Union, where he joins forces with inventor Alexey Pazhitnov (Nikita Efremov) to bring the game to the masses. Based on a true story, ""Tetris"" is a Cold War-era thriller on steroids, with double-crossing villains, unlikely heroes and a nail-biting race to the finish.","Taron Egerton, Nikita Efremov, Toby Jones, Sofya Lebedeva, Ben Miles",Jon S. Baird,"Gillian Berrie , Len Blavatnik , Gregor Cameron , Claudia Schiffer , Matthew Vaughn",Noah Pink,Apple TV+,"Marv Films , AI-Film",R (Language),"Mystery & Thriller , Biography , Drama",English,"Mar 31, 2023",1h 58m,Dolby Digital,,"Mar 24, 2023, Limited",,2.39:1,,,,,,,,
Finch,74%,68%,"In ""Finch,"" a man, a robot and a dog form an unlikely family in a powerful and moving adventure of one man's quest to ensure that his beloved canine companion will be cared for after he's gone. Tom Hanks stars as Finch, a robotics engineer and one of the few survivors of a cataclysmic solar event that has left the world a wasteland. But Finch, who has been living in an underground bunker for a decade, has built a world of his own that he shares with his dog, Goodyear. He creates a robot, played by Caleb Landry Jones, to watch over Goodyear when he no longer can. As the trio embarks on a perilous journey into a desolate American West, Finch strives to show his creation, who names himself Jeff, the joy and wonder of what it means to be alive. Their road trip is paved with both challenges and humor, as it's as difficult for Finch to goad Jeff and Goodyear to get along as it is for him to manage the dangers of the new world.","Tom Hanks, Caleb Landry Jones, Craig Luck, Ivor Powell, Kevin Misher",Miguel Sapochnik,"Kevin Misher , Jack Rapke , Jacqueline Levine , Ivor Powell","Craig Luck , Ivor Powell",,"ImageMovers , Amblin Entertainment , Walden Media , Reliance Entertainment , Misher Films",PG-13 (Brief Violent Images),"Sci-Fi , Drama",English,"Nov 5, 2021",1h 55m,,,,,,,,,,,,,
Cherry,37%,72%,"""Cherry"" follows the wild journey of a disenfranchised young man from Ohio who meets the love of his life, only to risk losing her through a series of bad decisions and challenging life circumstances. Inspired by the best-selling novel of the same name, ""Cherry"" features Tom Holland in the title role as an unhinged character who drifts from dropping out of college to serving in Iraq as an Army medic and is only anchored by his one true love, Emily (Ciara Bravo). When Cherry returns home a war hero, he battles the demons of undiagnosed PTSD and spirals into drug addiction, surrounding himself with a menagerie of depraved misfits. Draining his finances, Cherry turns to bank robbing to fund his addiction, shattering his relationship with Emily along the way. Brought to the screen in bold, gritty fashion by visionary directors Anthony and Joe Russo, ""Cherry"" is a darkly humorous, unflinching coming-of-age story of a man on a universal quest for purpose and human connection.","Tom Holland, Ciara Bravo, Jack Reynor, Michael Rispoli","Anthony Russo , Joe Russo","Jake Aust , Chris Castaldi , Jonathan Gray , Mike Larocca , John Parker , Matthew Rhodes , Anthony Russo , Joe Russo","Angela Russo-Otstot , Jessica Goldberg",Apple,"AGBO , Kasbah Films , The Hideaway Entertainment",R (Pervasive Language|Graphic Drug Abuse|Disturbing and Violent Images|Sexual Content),Drama,English,"Mar 12, 2021",2h 20m,Dolby Digital,,"Feb 26, 2021, Limited",,,(2.35:1),,,,,,,
The Greatest Beer Run Ever,43%,91%,"To show support for his neighborhood friends serving in Vietnam, Chickie Donohue (Zac Efron) decides to do something totally outrageous: travel to the frontline by himself to bring the soldiers a little piece of home -- their favorite can of American beer. However, what started as a well-meaning journey quickly turns into the adventure of a lifetime as Chickie confronts the reality of this controversial war and his reunions with his childhood buddies thrust him into the complexities and responsibilities of adulthood. Based on an incredible true story, ""The Greatest Beer Run Ever"" is a heartfelt coming-of-age tale about friendship, loyalty and sacrifice.","Zac Efron, Russell Crowe, Bill Murray, Kyle Allen, Jake Picking",Peter Farrelly,"David Ellison , Dana Goldberg , Don Granger , Andrew J. Muscato , Jake Myers","Peter Farrelly , Brian Hayes Currie , Pete Jones",Apple TV+,"Skydance Media , Living Films",R (Language|Some War Violence),"Drama , War",English,"Sep 30, 2022",2h 6m,Dolby Digital,,"Sep 30, 2022, Limited",,,,,,,,,,
Luck,48%,66%,"From Apple Original Films and Skydance Animation comes the story of Sam Greenfield, the unluckiest person in the world! Suddenly finding herself in the never-before-seen Land of Luck, she must unite with the magical creatures there to turn her luck around.","Eva Noblezada, Simon Pegg, Jane Fonda, Whoopi Goldberg, Colin O'Donoghue",Peggy Holmes,"John Lasseter , David Ellison , Dana Goldberg , David Eisenmann","Kiel Murray , Jonathan Aibel",,Skydance Animation,G,"Kids & Family , Comedy , Fantasy , Animation",English,"Aug 5, 2022",1h 45m,,(1.85:1),,,,,,,,,,,
Palmer,72%,87%,"Former high school football star Eddie Palmer (Justin Timberlake) went from hometown hero to convicted felon, earning himself 12 years in a state penitentiary. He returns home to Louisiana, where he moves back in with Vivian (June Squibb), the grandmother who raised him. While trying to keep his head down and rebuild a quiet life for himself, Palmer is haunted by memories of his glory days and the suspicious eyes of his small town community. Things become more complicated when Vivian’s hard-living neighbor Shelly (Juno Temple) disappears on a prolonged bender, leaving her precocious and unique 7-year-old son Sam (Ryder Allen), often the target of bullying, in Palmer’s reluctant care. In time, Palmer is drawn into a more hopeful world as he forges a connection with Sam through their shared experience of being made to feel different by those around them. Life improves for Palmer, and a romance develops between him and Sam’s teacher Maggie (Alisha Wainwright). An inspiring and unexpected journey unfolds for the three of them, but soon Palmer’s past threatens to tear apart this new life.","Justin Timberlake, Juno Temple, Alisha Wainwright, June Squibb, Ryder Allen",Fisher Stevens,"Charlie Corwin , Sidney Kimmel , Daniel Nadler , John Penotti , Charles B. Wessler",Cheryl Guerriero,,"SK Global , Sidney Kimmel Entertainment , Rhea Films (II) , Hercules Film Fund",R (Some Sexual Content/Nudity|Language|Brief Violence),Drama,English,"Jan 29, 2021",1h 51m,,,,,,(2.35:1),,,,,,,
Causeway,84%,71%,"""Causeway"" is an intimate portrait of a soldier struggling to adjust to her life after returning home to New Orleans.","Jennifer Lawrence, Brian Tyree Henry, Linda Emond, Jayne Houdyshell, Stephen Henderson",Lila Neugebauer,"Jennifer Lawrence , Justine Ciarrocchi","Ottessa Moshfegh , Luke Goebel , Elizabeth Sanders",A24,"IPR.VC , A24 , IAC Films , Excellent Cadaver",R (Drug Use|Some Language|Sexual References),Drama,English,"Nov 4, 2022",1h 32m,,(1.85:1),"Nov 4, 2022, Limited",,,,,,,,,,
On the Rocks,87%,50%,"Faced with sudden doubts about her marriage, a young New York mother teams up with her larger-than-life playboy father to tail her husband.","Bill Murray, Rashida Jones, Marlon Wayans, Jessica Henwick, Jenny Slate",Sofia Coppola,"Sofia Coppola , Youree Henley",Sofia Coppola,A24,"A24 , American Zoetrope",R,Comedy,English,"Oct 23, 2020",1h 36m,,(1.85:1),"Oct 2, 2020, Limited",,,,,,,,,,
The Banker,78%,100%,"In the 1960s, two entrepreneurs hatch an ingenious business plan to fight for housing integration and equal access to the American Dream.","Anthony Mackie, Samuel L. Jackson, Nicholas Hoult, Nia Long, Jessie T. Usher",George Nolfi,"Joel Viertel , Brad Feinstein , George Nolfi , Nnamdi Asomugha , Jonathan Baker , David Lewis Smith , Anthony Mackie","Niceole Levy , George Nolfi , David Lewis Smith , Stan Younger , Brad Kane",Apple,Iam21 Entertainment,PG-13 (Some Strong Language|A Sexual Reference|Smoking Throughout|Racial Epithets),"History , Drama",English,"Jan 8, 2020",2h 0m,,,"Mar 6, 2020, Limited",,,(2.35:1),,,,,,,
The Bloody Hundredth,100%,84%,"""The Bloody Hundredth"" is a new documentary that honors the real-life heroes of the 100th Bomb Group. Produced by Playtone-Amblin and narrated by Tom Hanks, the hour-long documentary spotlights the true stories of several characters and real-life airmen featured in ""Masters of the Air."" From the shock of Pearl Harbor to the joy of VE Day, ""The Bloody Hundredth"" is a record of what was endured and achieved by a group of young Americans when their country and the world needed them most.","Tom Hanks, Tom Hanks, Steven Spielberg, Gary Goetzman","Mark Herzog , Laurent Bouzereau",,,Apple TV+,,,"Documentary , History",English,"Mar 15, 2024",1h 2m,,,,,,,,,,,,,
The Tragedy of Macbeth,93%,74%,"Joel Coen's bold and fierce adaptation of ""Macbeth,"" a tale of murder, madness, ambition, and wrathful cunning.","Denzel Washington, Frances McDormand, Bertie Carvel, Alex Hassell, Corey Hawkins",Joel Coen,"Joel Coen , Robert Graf , Frances McDormand",Joel Coen,A24,"A24 , IAC Films",R (Violence),"Drama , Mystery & Thriller",English,"Jan 14, 2022",1h 45m,Dolby Atmos,,"Dec 25, 2021, Limited",,,,,(1.33:1),,,,,
Bread & Roses,100%,,"""Bread & Roses"" offers a powerful window into the seismic impact on women's rights and livelihoods after Kabul fell to the Taliban in 2021. The film follows three women, in real time, as they fight to recover their autonomy. Mani captures the spirit and resilience of Afghan women through a raw depiction of their harrowing plight.","Jennifer Lawrence, Justine Ciarrocchi, Sahra Mani, Malala Yousafzai, Farhad Khosravi",Sahra Mani,"Jennifer Lawrence , Justine Ciarrocchi , Sahra Mani",,Apple Original Films,Excellent Cadaver,,Documentary,English,"Nov 22, 2024",1h 28m,,,"Nov 22, 2024, Limited",,,,,,,,,,
Wolfwalkers,99%,98%,"In a time of superstition and magic, a young apprentice hunter, Robyn Goodfellowe, journeys to Ireland with her father to wipe out the last wolf pack. While exploring the forbidden lands outside the city walls, Robyn befriends a free-spirited girl, Mebh, a member of a mysterious tribe rumored to have the ability to transform into wolves by night. As they search for Mebh's missing mother, Robyn uncovers a secret that draws her further into the enchanted world of the ""Wolfwalkers"" and risks turning into the very thing her father is tasked to destroy.","Sean Bean, Honor Kneafsey, Eva Whittaker, Simon McBurney","Tomm Moore , Ross Stewart","Tomm Moore , Stéphan Roelants , Nora Twomey , Paul Young",Will Collins,GKIDS,"Cartoon Saloon , SIF 309 Film Music , Dentsu Entertainment USA",PG (Peril|Brief Language|Scary Images|Sequences of Violence|Some Thematic Elements),"Fantasy , Adventure , Animation",English,"Dec 11, 2020",1h 43m,,(1.85:1),"Nov 13, 2020, Limited",,,,,,,,,,
Flora and Son,93%,84%,"Single mom Flora (Eve Hewson) is at a loss about what to do with her rebellious teenage son, Max (Orén Kinlan). Encouraged by the police to find Max a hobby, Flora tries to occupy him with a beat-up acoustic guitar. With the help of a washed-up LA musician (Joseph Gordon-Levitt), Flora and Max discover the transformative power of music. From the musical mind of John Carney, ""Flora and Son"" explores the bond between a mother and son on a journey toward a new harmony.","Eve Hewson, Orén Kinlan, Joseph Gordon-Levitt, Jack Reynor, Keith McErlean",John Carney,"Anthony Bregman , John Carney , Peter Cron , Rebecca O'Flanagan , Robert Walpole",John Carney,Apple Original Films,"Treasure Entertainment , Fís Éireann/Screen , Distressed Films , FilmNation Entertainment , Fifth Season , Likely Story",R (Brief Drug Use|Sexual References|Language Throughout),"Musical , Comedy , Drama , Music , Romance",English,"Sep 29, 2023",1h 34m,,,"Sep 22, 2023, Limited",,,,,,,,,,
Emancipation,45%,58%,"""Emancipation"" tells the triumphant story of Peter (Will Smith), a man who escapes from slavery, relying on his wits, unwavering faith and deep love for his family to evade cold-blooded hunters and the unforgiving swamps of Louisiana on his quest for freedom. The film is inspired by the 1863 photos of ""Whipped Peter,"" taken during a Union Army medical examination, that first appeared in Harper's Weekly. One image, known as ""The Scourged Back,"" which shows Peter’s bare back mutilated by a whipping delivered by his enslavers, ultimately contributed to growing public opposition to slavery.","Will Smith, Ben Foster, Charmaine Bingwa, Gilbert Owuor, Mustafa Shakir",Antoine Fuqua,"Will Smith , Jon Mone , Joey McFarland , Todd Black",Bill Collage,Apple TV+,"Westbrook Studios , Escape Artists , McFarland Entertainment",R (Strong Racial Violence|Language|Disturbing Images),"History , Drama , Mystery & Thriller",English,"Dec 9, 2022",2h 12m,,,"Dec 2, 2022, Limited",,2.39:1,,,,,,,,
