Prometheus,73%,68%,"The discovery of a clue to mankind's origins on Earth leads a team of explorers to the darkest parts of the universe. Two brilliant young scientists lead the expedition. Shaw (Noomi Rapace) hopes that they will meet a race of benevolent, godlike beings who will in some way verify her religious beliefs, while Holloway (Logan Marshall-Green) is out to debunk any spiritual notions. However, neither the scientists nor their shipmates are prepared for the unimaginable terrors that await them.","Noomi Rapace, Michael Fassbender, Charlize Theron, Idris Elba, Guy Pearce",Ridley Scott,"Ridley Scott , David Giler , Walter Hill","Jon Spaihts , Damon Lindelof",20th Century Fox,"Scott Free Productions , Brandywine Productions",R (Sci-Fi Violence|Brief Language|Some Intense Images),"Sci-Fi , Horror , Mystery & Thriller",English,"Mar 1, 2013",2h 3m,"Datasat , Dolby",,"Jun 8, 2012, Wide",$126.5M,,,,,,,,,
The Last Duel,85%,81%,"The Last Duel is a cinematic and thought-provoking drama set in the midst of the Hundred Years War that explores the ubiquitous power of men, the frailty of justice and the strength and courage of one woman willing to stand alone in the service of truth. Based on actual events, the film unravels long-held assumptions about France's last sanctioned duel between Jean de Carrouges and Jacques Le Gris, two friends turned bitter rivals. Carrouges is a respected knight known for his bravery and skill on the battlefield. Le Gris is a Norman squire whose intelligence and eloquence make him one of the most admired nobles in court. When Carrouges' wife, Marguerite, is viciously assaulted by Le Gris, a charge he denies, she refuses to stay silent, stepping forward to accuse her attacker, an act of bravery and defiance that puts her life in jeopardy. The ensuing trial by combat, a grueling duel to the death, places the fate of all three in God's hands.","Matt Damon, Adam Driver, Jodie Comer, Ben Affleck, Marton Csokas",Ridley Scott,"Ridley Scott , Kevin J. Walsh , Jennifer Fox , Nicole Holofcener","Nicole Holofcener , Ben Affleck , Matt Damon",20th Century Studios,"TSG Entertainment , 20th Century Studios , Scott Free Productions , Pearl Street Films",R (Sexual Assault|Language|Sexual Content|Some Graphic Nudity|Strong Violence),"History , Drama",English,"Nov 30, 2021",2h 33m,Dolby Atmos,,"Oct 15, 2021, Wide",$10.8M,,(2.35:1),,,,,,,
(500) Days of Summer,86%,84%,"Tom (Joseph Gordon-Levitt), greeting-card writer and hopeless romantic, is caught completely off-guard when his girlfriend, Summer (Zooey Deschanel), suddenly dumps him. He reflects on their 500 days together to try to figure out where their love affair went sour, and in doing so, Tom rediscovers his true passions in life.","Joseph Gordon-Levitt, Zooey Deschanel, Geoffrey Arend, Chloë Grace Moretz, Matthew Gray Gubler",Marc Webb,"Jessica Tuchinsky , Mark Waters , Mason Novick , Steven J. Wolfe","Scott Neustadter , Michael H. Weber",Fox,Watermark,PG-13 (Sexual Material|Language),"Comedy , Drama , Romance",English,"Mar 1, 2013",1h 35m,,,"Aug 7, 2009, Wide",$32.4M,,,,,,,,,
Classified,,8%,"Operating alone in the field for more than 20 years, a CIA hitman (Aaron Eckhart) uses the ""Help Wanted"" section of the newspapers to get his orders from the Agency. His long-lost daughter (Abigail Breslin), now a UK MI6 analyst, tracks him down to deliver shocking news: his CIA boss (Tim Roth) has been dead for years and the division long since shut down. Together, they set out to discover whose orders he's been executing.","Aaron Eckhart, Tim Roth, Abigail Breslin, Brandon Lessard, Myles Clohessy",Roel Reiné,"Jordan Dykstra , Gabriel Georgiev , Ellen S. Wander",Bob DeRosa,Saban Films,"Underdogg Entertainment , Film Bridge International , Midwest , Filmology Finance",R (Violence and Language),"Action , Mystery & Thriller",English,"Oct 22, 2024",1h 45m,,,,,,,,,,,,,
Spy,95%,78%,"Despite having solid field training, CIA analyst Susan Cooper (Melissa McCarthy) has spent her entire career as a desk jockey, working hand-in-hand with dashing agent Bradley Fine (Jude Law). Using high-tech equipment and a hidden earpiece, Susan is the guardian angel who helps Bradley avoid danger. However, when Bradley is assassinated by Bulgarian arms dealer Rayna Boyanov (Rose Byrne), Susan wrangles her way into her first undercover assignment to help capture Boyanov and avenge Bradley.","Melissa McCarthy, Jason Statham, Rose Byrne, Miranda Hart, Bobby Cannavale",Paul Feig,"Peter Chernin , Jenno Topping , Paul Feig , Jessie Henderson",Paul Feig,20th Century Fox,"Greenery Studios , Chernin Entertainment , Twentieth Century Fox , Feigco Entertainment",R (Language Throughout|Brief Graphic Nudity|Some Sexual Content|Violence),"Comedy , Action",English,"Sep 4, 2015",1h 55m,Dolby Atmos,,"Jun 5, 2015, Wide",,,,,,,,,,
Girl in the Basement,,60%,"The horrific story of Sara, a vibrant teen girl who was looking forward to her 18th birthday so she could move away from her controlling father, Don. Her world becomes extremely dark when her father imprisons her in the basement of their home.","Stefanie Scott, Judd Nelson, Joely Fisher, Emily Topper, Emma Myers",Elisabeth Röhm,"Alex Kerr , Ron Robinson , Eric Tomosunas",,,Big Dreams Entertainment,,"Crime , Drama",English,"Feb 28, 2021",1h 30m,,,,,,,,,,,,,
My Penguin Friend,86%,96%,"A sweeping family adventure, My Penguin Friend is a triumphant tale of friendship between a lonely father and a little lost penguin who recharges his spirit and heals his family with an unshakable, ocean-crossing loyalty. Humble fisherman João (international star Jean Reno) has turned away from the world in the wake of tragedy. But when he discovers a penguin drifting alone in the ocean, drenched in oil from a spill, his first instinct is to help. To his wife's (Oscar nominee Adriana Barraza) dismay, he not only rescues the sea creature, but takes the flightless bird under his wing. For the first time in years João starts to feel joy, even if he cannot fathom just how unbreakable a bond is being formed. When the penguin suddenly disappears back into the immense wilds of the ocean, João believes it is impossible that he will ever see his friend again. But thousands of miles away, the penguin is caught in misadventures of his own, determined to use his unique GPS-like powers to find his way back to the place he now considers home. Based on an emotional true story that riveted the world and filmed on the spectacular coasts of Brazil and Argentina, My Penguin Friend is a tale that traverses the magic of the ocean, the beauty of nature, and the transformative power of love.","Jean Reno, Adriana Barraza, Nicolás Francella, Alexia Moyano, Rocío Hernández",David Schurmann,"Robin Jonas , Shaked Berenson , Patrick Ewald , Nicolas Veinberg , Steven P. Wegner , Jonathan Lim , Andreas Wentz","Paulina Lagudi Ulrich , Kristen Lazarian",Roadside Attractions,"Sur-Film , City Hill Arts , Content Studios , Schurmann Filmes , Ventre Studio",PG,"Kids & Family , Drama",English,"Oct 1, 2024",1h 37m,,,"Aug 16, 2024, Wide",$2.8M,,(2.35:1),,,,,,,
True Story,45%,38%,"New York Times journalist Michael Finkel (Jonah Hill) loses his job when it's revealed that he was not entirely truthful in a cover story he wrote on contemporary slave trading in Africa. His world collapses even further when he learns he's a victim of identity theft; a man named Christian Longo (James Franco) assumed Finkel's name and stood accused of murdering his own family. Seeing a way to rebuild his shattered reputation, Finkel meets with Longo to hear his story.","Jonah Hill, James Franco, Felicity Jones, Robert John Burke, Gretchen Mol",Rupert Goold,"Dede Gardner , Jeremy Kleiner , Anthony Katagas","Rupert Goold , David Kajganich",Fox Searchlight,"New Regency Pictures , Plan B Entertainment",R (Some Disturbing Material|Language),"Crime , Drama , Mystery & Thriller",English,"Sep 15, 2016",1h 44m,,,"Apr 17, 2015, Limited",$4.7M,,,,,,,,,
Perfect Days,96%,90%,Hirayama seems utterly content with his simple life as a cleaner of toilets in Tokyo. Outside of his very structured everyday routine he enjoys his passion for music and for books. And he loves trees and takes photos of them. A series of unexpected encounters gradually reveal more of his past. A deeply moving and poetic reflection on finding beauty in the everyday world around us.,"Kôji Yakusho, Tokio Emoto, Arisa Nakano, Aoi Yamada, Yumi Asô",Wim Wenders,"Koji Yanai , Wim Wenders , Takuma Takasaki , Yusuke Kobayashi , Reiko Kunieda , Keiko Tominaga","Takuma Takasaki , Wim Wenders",NEON,"Master Mind Productions, Inc.",PG (Smoking|Partial Nudity|Some Language),Drama,Japanese,"Mar 5, 2024",2h 4m,Dolby Digital,,"Nov 10, 2023, Limited",$3.8M,,,,(1.33:1),,,,,
Brooklyn,97%,87%,"Young Irish immigrant Eilis Lace (Saoirse Ronan) navigates her way through 1950s Brooklyn. Lured by the promise of America, Eilis departs Ireland and the comfort of her mother's home for the shores of New York City. The initial shackles of homesickness quickly diminish as a fresh romance sweeps Eilis into the intoxicating charm of love. But soon, her past disrupts her new vivacity, and Eilis must choose between two countries and the lives that exist within.","Saoirse Ronan, Domhnall Gleeson, Emory Cohen, Jim Broadbent, Julie Walters",John Crowley,"Finola Dwyer , Amanda Posey",Nick Hornby,Fox Searchlight,"Item 7 , Wildgaze Films , Parallel Films , Finola Dwyer Prods.",PG-13 (Brief Strong Language|A Scene of Sexuality),"Romance , History , Drama",British English,"Feb 23, 2016",1h 52m,,,"Nov 25, 2015, Wide",$38.3M,,,,,,,,,
The First Omen,83%,69%,"When a young American woman is sent to Rome to begin a life of service to the church, she encounters a darkness that causes her to question her own faith and uncovers a terrifying conspiracy that hopes to bring about the birth of evil incarnate.","Nell Tiger Free, Ralph Ineson, Sônia Braga, Tawfeek Barhom, María Caballero",Arkasha Stevenson,"David S. Goyer , Keith Levine","Tim Smith , Arkasha Stevenson , Keith Thomas",20th Century Studios,"Serbia Film Commission , Cattleya , 20th Century Studios , TSG Entertainment , Kiwii , Phantom Four Films , The Government of Canada Income Tax Credit Program",R (Grisly/Disturbing Images|Brief Graphic Nudity|Violent Content),"Horror , Mystery & Thriller",English,"May 28, 2024",1h 59m,,(1.85:1),"Apr 5, 2024, Wide",$20.1M,,,,,,,,,
Immaculate,71%,58%,"Sydney Sweeney (Anyone But You, Euphoria, The White Lotus) stars as Cecilia, an American nun of devout faith, embarking on a new journey in a remote convent in the picturesque Italian countryside. Cecilia's warm welcome quickly devolves into a nightmare as it becomes clear her new home harbors a sinister secret and unspeakable horrors.","Sydney Sweeney, Álvaro Morte, Benedetta Porcaroli, Simona Tabasco, Giorgio Colangeli",Michael Mohan,"Sydney Sweeney , Jonathan Davino , David Bernad , Teddy Schwarzman , Michael Heimler",Andrew Lobel,NEON,"Fifty-Fifty Films , Black Bear Pictures",R (Nudity|Grisly Images|Some Language|Strong Violent Content),Horror,English,"Apr 16, 2024",1h 29m,,,"Mar 22, 2024, Wide",$15.7M,,,,,,,,,
Mothers' Instinct,52%,47%,"Set in the early '60s, best friends and neighbors Alice (Jessica Chastain) and Celine (Anne Hathaway) both live an idyllic traditional lifestyle with manicured lawns, successful husbands, and sons of the same age. Life's perfect harmony is suddenly shattered after a tragic accident. Guilt, suspicion and paranoia combine to unravel their sisterly bond a psychological battle of wills begins as the maternal instinct reveals its darker side.","Anne Hathaway, Jessica Chastain, Eamon Patrick O'Connell, Anders Danielsen Lie, Josh Charles",Benoît Delhomme,"Kelly Carmichael , Jessica Chastain , Anne Hathaway , Paul Nelson , Jacques-Henri Bronckart",Sarah Conradt-Kroehler,NEON,"Versus Production , Anton , Mosaic , Freckle Films , Wheelhouse Productions",R (Some Violence|Brief Sexuality),Mystery & Thriller,English,"Aug 13, 2024",1h 34m,,,"Jul 26, 2024, Limited",,,,,,,,,,
Kingdom of the Planet of the Apes,80%,77%,"Director Wes Ball breathes new life into the global, epic franchise set several generations in the future following Caesar's reign, in which apes are the dominant species living harmoniously and humans have been reduced to living in the shadows. As a new tyrannical ape leader builds his empire, one young ape undertakes a harrowing journey that will cause him to question all that he has known about the past and to make choices that will define a future for apes and humans alike.","Owen Teague, Freya Allan, Kevin Durand, William H. Macy, Peter Macon",Wes Ball,"Wes Ball , Joe Hartwick Jr. , Rick Jaffa , Amanda Silver , Jason Reed",Josh Friedman,20th Century Studios,"Jason T. Reed Productions , Oddball Entertainment , TSG Entertainment , 20th Century Studios",PG-13 (Intense Sci-Fi Violence/Action),"Sci-Fi , Action , Adventure",English,"Jul 9, 2024",2h 25m,"Dolby Atmos , Dolby Digital",,"May 10, 2024, Wide",$171.1M,2.39:1,,,,,,,,
The Quincy Avery Effect,,,"A game-changing story of grit and victory. From 1,000 nights of homelessness to coaching NFL's top Quarterbacks, Quincy Avery continues to break barriers, unlocking the full potential of athletes and reshaping the future of the game.",,Bryant Robinson,,,Hulu,Andscape,,"Documentary , Sports , Biography",English,"Apr 23, 2025",1h 31m,,,,,,,,,,,,,
Jojo Rabbit,80%,94%,Jojo is a lonely German boy who discovers that his single mother is hiding a Jewish girl in their attic. Aided only by his imaginary friend -- Adolf Hitler -- Jojo must confront his blind nationalism as World War II continues to rage on.,"Roman Griffin Davis, Thomasin McKenzie, Scarlett Johansson, Taika Waititi, Sam Rockwell",Taika Waititi,"Carthew Neal , Taika Waititi , Chelsea Winstanley",Taika Waititi,Fox Searchlight,Unison Films,PG-13 (Mature Thematic Content|Language|Some Disturbing Images|Violence),"Comedy , Drama",English,"Nov 8, 2019",1h 48m,Dolby Digital,(1.85:1),"Nov 8, 2019, Wide",$33.4M,,,,,,,,,
True Grit,95%,85%,"After an outlaw named Tom Chaney (Josh Brolin) murders her father, feisty 14-year-old farm girl Mattie Ross (Hailee Steinfeld) hires Rooster Cogburn (Jeff Bridges), a boozy, trigger-happy lawman, to help her find Chaney and avenge her father. The bickering duo are not alone in their quest, for a Texas Ranger named LaBoeuf (Matt Damon) is also tracking Chaney for reasons of his own. Together the unlikely trio ventures into hostile territory to dispense some Old West justice.","Jeff Bridges, Matt Damon, Josh Brolin, Barry Pepper","Joel Coen , Ethan Coen","Scott Rudin , Joel Coen , Ethan Coen","Joel Coen , Ethan Coen",Paramount Pictures,"Scott Rudin Productions , Mike Zoss Productions",PG-13 (Int. Seq. of Western Violence|Disturbing Images),"Western , Drama",English,"Jul 1, 2013",1h 50m,"SDDS , Dolby Digital , DTS",,"Dec 22, 2010, Wide",$171.0M,,,,,,,,,
Red Sparrow,45%,51%,"Prima ballerina Dominika Egorova faces a bleak and uncertain future after she suffers an injury that ends her career. She soon turns to Sparrow School, a secret intelligence service that trains exceptional young people to use their minds and bodies as weapons. Egorova emerges as the most dangerous Sparrow after completing the sadistic training process. As she comes to terms with her new abilities, Dominika meets a CIA agent who tries to convince her that he is the only person she can trust.","Jennifer Lawrence, Joel Edgerton, Charlotte Rampling, Matthias Schoenaerts, Mary-Louise Parker",Francis Lawrence,"Peter Chernin , David Ready , Jenno Topping , Steven Zaillian",Justin Haythe,20th Century Fox,"TSL Entertainment , Chernin Entertainment",R (Sexual Content|Language|Some Graphic Nudity|Strong Violence|Torture),Mystery & Thriller,English,"Apr 4, 2018",2h 19m,Dolby Atmos,,"Mar 2, 2018, Wide",$46.7M,,(2.35:1),,,,,,,
Alien: Covenant,65%,55%,"Bound for a remote planet on the far side of the galaxy, members (Katherine Waterston, Billy Crudup) of the colony ship Covenant discover what they think to be an uncharted paradise. While there, they meet David (Michael Fassbender), the synthetic survivor of the doomed Prometheus expedition. The mysterious world soon turns dark and dangerous when a hostile alien life-form forces the crew into a deadly fight for survival.","Michael Fassbender, Katherine Waterston, Billy Crudup, Danny McBride, Demián Bichir",Ridley Scott,"Ridley Scott , Mark Huffam , Michael Schaefer , David Giler , Walter Hill","John Logan , Dante Harper",20th Century Fox,"Brandywine Productions , Scott Free Productions",R (Language|Bloody Images|Sci-Fi Violence|Some Sexuality/Nudity),"Sci-Fi , Horror , Mystery & Thriller",English,"Jul 10, 2017",2h 2m,"Datasat , Dolby Atmos",,"May 19, 2017, Wide",$74.2M,,(2.35:1),,,,,,,
BlackBerry,97%,94%,"'BlackBerry' tells the story of Mike Lazaridis and Jim Balsillie, the two men that charted the course of the spectacular rise and catastrophic demise of the world's first smartphone.","Jay Baruchel, Glenn Howerton, Matt Johnson, Rich Sommer, Michael Ironside",Matt Johnson,"Niv Fichman , Matt Miller , Fraser Ash , Kevin Krikst","Matt Johnson , Matt Miller",IFC Films,"IPR.VC , Ontario Creates , Rhombus Media , Téléfilm Canada , Paramount , Zapruder Films , Canadian Broadcasting Corporation",R (Language Throughout),"Comedy , Drama , History",English,"Jun 2, 2023",1h 59m,Dolby Digital,,"May 12, 2023, Limited",$1.5M,,,,,,,,,
A Man Called Otto,70%,97%,"Based on the comical and moving New York Times bestseller, A Man Called Otto tells the story of Otto Anderson (Tom Hanks), a grumpy widower whose only joy comes from criticizing and judging his exasperated neighbors. When a lively young family moves in next door, he meets his match in quick-witted and very pregnant Marisol, leading to an unexpected friendship that will turn his world upside-down.","Tom Hanks, Mack Bayda, Mariana Treviño, Rachel Keller, Manuel García-Rulfo",Marc Forster,"Fredrik Wikström , Rita Wilson , Tom Hanks , Gary Goetzman",David Magee,Columbia Pictures,"Playtone , Columbia Pictures , Sony Pictures , Stage 6 Films , SF Productions",PG-13 (Mature Thematic Material|Language|Suicide Attempts),"Comedy , Drama",English,"Feb 28, 2023",2h 6m,Dolby Digital,(1.85:1),"Jan 13, 2023, Wide",$64.1M,,,,,,,,,
No One Will Save You,83%,56%,"""No One Will Save You"" introduces Brynn Adams (Kaitlyn Dever), a creative and talented young woman who’s been alienated from her community. Lonely but ever hopeful, Brynn finds solace within the walls of the home where she grew up--until she's awakened one night by strange noises from decidedly unearthly intruders. What follows is an action-packed face-off between Brynn and a host of extraterrestrial beings who threaten her future while forcing her to deal with her past.","Kaitlyn Dever, Zack Duhame, Ginger Cressman, Geraldine Singer, Rose Bianca Grue",Brian Duffield,"Brian Duffield , Tim White , Trevor White , Allan Mandelbaum","Brian Duffield , Brian Duffield",Hulu,"20th Century Fox , Star Thrower Entertainment",PG-13 (Violent Content|Terror),"Mystery & Thriller , Horror , Sci-Fi",English,"Sep 22, 2023",1h 33m,,,,,,,,,,,,,
War of the Worlds,76%,42%,"Dockworker Ray Ferrier (Tom Cruise) struggles to build a positive relationship with his two children, Rachel (Dakota Fanning) and Robbie (Justin Chatwin). When his ex-wife, Mary Ann (Miranda Otto), drops them off at Ferrier's house, it seems as though it will be just another tension-filled weekend. However, when electromagnetic pulses of lightning strike the area, the strange event turns out to be the beginning of an alien invasion, and Ferrier must now protect his children as they seek refuge.","Tom Cruise, Dakota Fanning, Miranda Otto, Justin Chatwin, Tim Robbins",Steven Spielberg,"Kathleen Kennedy , Colin Wilson","H.G. Wells , Josh Friedman , David Koepp",Paramount Pictures,Paramount Pictures,PG-13 (Frightening Sequences|Disturbing Images|Sci-Fi Violence),"Sci-Fi , Adventure , Action",English,"Nov 14, 2014",1h 56m,"Surround , Dolby SRD , DTS , SDDS",(1.37:1),"Jun 29, 2005, Wide",$234.3M,,,,,,,,,
Fantastic Mr. Fox,93%,85%,"After 12 years of bucolic bliss, Mr. Fox (George Clooney) breaks a promise to his wife (Meryl Streep) and raids the farms of their human neighbors, Boggis, Bunce and Bean. Giving in to his animal instincts endangers not only his marriage but also the lives of his family and their animal friends. When the farmers force Mr. Fox and company deep underground, he has to resort to his natural craftiness to rise above the opposition.","George Clooney, Meryl Streep, Jason Schwartzman, Bill Murray, Wallace Wolodarsky",Wes Anderson,"Wes Anderson , Scott Rudin , Allison Abbate , Jeremy Dawson","Wes Anderson , Noah Baumbach",20th Century Fox,American Empirical Pictures,PG (Slang Humor|Action|Smoking),"Kids & Family , Comedy , Adventure , Animation",English,"Mar 1, 2013",1h 28m,,,"Nov 25, 2009, Wide",$21.0M,,,,,,,,,
The Revenant,78%,84%,"While exploring the uncharted wilderness in 1823, frontiersman Hugh Glass (Leonardo DiCaprio) sustains life-threatening injuries from a brutal bear attack. When a member (Tom Hardy) of his hunting team kills his young son (Forrest Goodluck) and leaves him for dead, Glass must utilize his survival skills to find a way back to civilization. Grief-stricken and fueled by vengeance, the legendary fur trapper treks through the snowy terrain to track down the man who betrayed him.","Leonardo DiCaprio, Tom Hardy, Domhnall Gleeson, Will Poulter",Alejandro González Iñárritu,"Arnon Milchan , Steve Golin , Alejandro González Iñárritu , Mary Parent , Keith Redmon , James W. Skotchdopole","Mark L. Smith , Alejandro González Iñárritu",20th Century Fox,"Appian Way , New Regency Pictures , M Prods , Anonymous Content",R (Brief Nudity|A Sexual Assault|Violence|Gory Images|Language|Strong Frontier Combat),"Adventure , Western",English,"Mar 22, 2016",2h 36m,"Dolby Atmos , Dolby Digital , SDDS , Datasat",,"Jan 8, 2016, Wide",$183.6M,,(2.35:1),,,,,,,
Control Freak,64%,69%,"A motivational speaker, plagued by an uncontrollable itch on her head, becomes infected with a parasitic demon from her homeland.","Kelly Marie Tran, Miles Robbins, Toan Le, Kiều Chinh, Callie Johnson",Shal Ngo,"David Brooks , Shaum S. Sengupta , Jenna Cavelle , Arbi Pedrossian",Shal Ngo,Hulu,WorthenBrooks,,Horror,English,"Mar 13, 2025",1h 44m,,,,,,,,,,,,,
The Social Network,96%,87%,"In 2003, Harvard undergrad and computer genius Mark Zuckerberg (Jesse Eisenberg) begins work on a new concept that eventually turns into the global social network known as Facebook. Six years later, he is one of the youngest billionaires ever, but Zuckerberg finds that his unprecedented success leads to both personal and legal complications when he ends up on the receiving end of two lawsuits, one involving his former friend (Andrew Garfield). Based on the book ""The Accidental Billionaires.""","Jesse Eisenberg, Andrew Garfield, Justin Timberlake, Armie Hammer, Max Minghella",David Fincher,"Scott Rudin , Dana Brunetti , Michael De Luca , Ceán Chaffin",Aaron Sorkin,Sony Pictures Entertainment,"Scott Rudin Productions , Trigger Street Productions , Michael De Luca",PG-13 (Language|Drug and Alcohol Use|Sexual Content),"Drama , Biography",English,"Jun 5, 2012",2h 0m,"SDDS , Dolby Digital , DTS",,"Oct 1, 2010, Wide",$96.9M,,,"Jan 7, 2011",,,,,,
Mission: Impossible - Ghost Protocol,94%,76%,"Blamed for a terrorist attack on the Kremlin, Ethan Hunt (Tom Cruise) and the entire IMF agency are disavowed by the U.S. government, while the president initiates the Ghost Protocol. Forced to go ""off the grid"" -- left without resources or backup -- Hunt must somehow clear the agency's name and prevent another attack. Complicating matters even more, Ethan must undertake the impossible mission with a group of fellow IMF fugitives whose actual motives are suspect.","Tom Cruise, Jeremy Renner, Simon Pegg, Paula Patton, Michael Nyqvist",Brad Bird,"Tom Cruise , J.J. Abrams , Bryan Burk","Josh Appelbaum , Andre Nemec",Paramount Pictures,"TC Productions , Bad Robot , Skydance Media , Paramount Pictures",PG-13 (Seq of Intense Action Violence),"Action , Adventure , Mystery & Thriller",English,"Dec 31, 2013",2h 13m,"SDDS , Dolby Digital",,"Dec 21, 2011, Wide",$209.4M,,,,,,,,,
Prospect,89%,74%,A man and his teenage daughter encounter nonstop danger while searching for valuable gems on an alien moon.,"Pedro Pascal, Sophie Thatcher, Jay Duplass, Andre Royo","Zeek Earl , Chris Caldwell","Dan Balgoyen , Garrick Dion , Scott Glassgold , Andrew Miano , Matthias Mellinghaus , Chris Weitz","Zeek Earl , Chris Caldwell",Gunpowder & Sky,"Depth of Field , Gunpowder & Sky , BRON Studios",R (Some Violence/Bloody Images),"Sci-Fi , Adventure , Mystery & Thriller",English,"Mar 8, 2019",1h 38m,,,"Nov 2, 2018, Limited",,,,,,,,,,
Sleeping Dogs,42%,82%,"In this gripping crime thriller, Russell Crowe stars as Roy Freeman, an ex-homicide detective with a fractured memory, forced to revisit a case he can't remember. As a man's life hangs in the balance on death row, Freeman must piece together the brutal evidence from a decade-old murder investigation, uncovering a sinister web of buried secrets and betrayals linking to his past. With only instincts to trust, he faces a chilling truth -- sometimes, it's best to let sleeping dogs lie.","Russell Crowe, Karen Gillan, Marton Csokas, Thomas Wright, Harry Greenwood",Adam Cooper,"Mark Fasano , Adam Cooper , Deborah Glover , Pouya Shahbazian , Bill Collage , Arun Kumar","Adam Cooper , Bill Collage",The Avenue,Film Victoria,R (Sexual Content|Language|Violence/Bloody Images),"Mystery & Thriller , Crime , Drama",English,"Apr 9, 2024",1h 51m,,,"Mar 22, 2024, Limited",,,,,,,,,,
