Purple Rain,72%,78%,"A victim of his own anger, the Kid (Prince) is a Minneapolis musician on the rise with his band, the Revolution, escaping a tumultuous home life through music. While trying to avoid making the same mistakes as his truculent father (Clarence Williams III), the Kid navigates the club scene and a rocky relationship with a captivating singer, Apollonia (Apollonia Kotero). But another musician, Morris (Morris Day), looks to steal the Kid's spotlight -- and his girl.","Prince, Apollonia Kotero, Morris Day, Jerome Benton, Clarence Williams III",Albert Magnoli,"Robert Cavallo , Steven Fargnoli , Joseph Ruffalo","Albert Magnoli , William Blinn",Warner Bros. Pictures,"Purple Films , Warner Bros.",R,"Musical , Drama , Romance",English,"Jul 27, 1984, Wide",,1h 51m,,Surround,"Jan 15, 2008",,,"Mar 5, 2025",,,,
The Room Next Door,81%,76%,"Ingrid (Julianne Moore) and Martha (Tilda Swinton) were close friends in their youth, when they worked together at the same magazine. Ingrid went on to become an autofiction novelist while Martha became a war reporter, and they were separated by the circumstances of life. After years of being out of touch, they meet again in an extreme but strangely sweet situation.","Julianne Moore, Tilda Swinton, John Turturro, Alex Høgh Andersen, Alessandro Nivola",Pedro Almodóvar,Agustín Almodóvar,Pedro Almodóvar,Sony Pictures Classics,"El Deseo , Washington Square Films , Movistar Plus+",PG-13 (Strong Language|Some Sexual References|Thematic Content),Drama,English,"Jan 17, 2025, Wide",$2.4M,1h 47m,,Dolby Digital,"Feb 18, 2025",2.39:1,,,,,,
Night of the Zoopocalypse,,,"After a meteor unleashes a virus that turns zoo animals into zombies, a mountain lion (David Harbour) and wolf (Gabbi Kosmidis) lead a team of surviving animals to stop the virus and rescue their zoo.","David Harbour, Scott Thompson, Paul Sun-Hyung Lee, Gabriella Kosmidis","Ricardo Curtis , Rodrigo Perez-Castro","Steven Hoban , Mark Smith , Wes Lui , Yohann Comte , Joe Iacono","Steven Hoban , James Kee",Viva Pictures,Copperheart Entertainment,PG,"Comedy , Fantasy , Animation , Horror , Kids & Family",English,"Mar 7, 2025, Wide",,1h 31m,,,,,(1.85:1),,,,,
All We Imagine as Light,100%,68%,"The light, the lives, and the textures of contemporary, working-class Mumbai are explored and celebrated by writer/director Payal Kapadia, who won the Grand Prize at this year's Cannes Film Festival for her revelatory fiction feature debut. Centering on two roommates who also work together in a city hospital--head nurse Prabha (Kani Kusruti) and recent hire Anu (Divya Prabha)--plus their coworker, cook Parvaty (Chhaya Kadam), Kapadia's film alights on moments of connection and heartache, hope and disappointment. Prabha, her husband from an arranged marriage living in faraway Germany, is courted by a doctor at her hospital; Anu carries on a romance with a Muslim man, which she must keep a secret from her strict Hindu family; Parvaty finds herself dealing with a sudden eviction from her apartment. Kapadia captures the bustle of the metropolis and the open-air tranquility of a seaside village with equal radiance, articulated by her superb actresses and by the camera with a lyrical naturalism that occasionally drifts into dreamlike incandescence. All We Imagine as Light is a soulful study of the transformative power of friendship and sisterhood, in all its complexities and richness.","Kani Kusruti, Divya Prabha, Chhaya Kadam, Hridhu Haroon, Payal Kapadia",Payal Kapadia,,Payal Kapadia,Sideshow / Janus Films,"Les Films Fauves , BALDR Film , Petit Chaos , arte France Cinéma , Pulpa Film , Chalk and Cheese , Another Birth",,Drama,Malayalam,"Nov 15, 2024, Limited",$1.1M,1h 58m,,Dolby Digital,"Feb 4, 2025",,(1.66:1),,,,,
Vermiglio,93%,95%,"The lush and breathtaking beauty of the Alps, filmed with painterly grace under natural light from frigid winter to redemptive spring, provides the physical and emotional backdrop for 'Vermiglio,' Maura Delpero’s visionary film, which won the Silver Lion at the 2024 Venice Film Festival. This singular portrait of a sprawling family, set in the small, mountainous village of Vermiglio during the waning days of WWII, follows a series of dramatic, consequential events after the arrival of a taciturn Sicilian soldier (Giuseppe De Domenico), who hides out in town after deserting the army. While there, the soldier develops a romance with the family's eldest daughter, Lucia (Martina Scrinzi). 'Vermiglio' shows the lives of a provincial family in a remote village suspended in time by the customs of a fading era. Conjuring stories from her own family's past, Delpero creates a deeply personal and human tale that recalls the great neorealist movement in Italian cinema, but through Lucia's perspective 'Vermiglio' feels distinct and novel.","Tommaso Ragno, Giuseppe De Domenico, Carlotta Gamba, Roberta Rovelli, Sara Serraiocco",Maura Delpero,"Carole Baraton , Tatjana Kozar , Francesca Andreoli",Maura Delpero,Sideshow / Janus Films,"Cinedora , RAI Cinema , Charades , Versus Production",,Drama,Italian,"Dec 25, 2024, Limited",$180.6K,1h 59m,,,,,,,,,,
Soundtrack to a Coup d'État,97%,98%,"United Nations, 1960: the Global South ignites a political earthquake, jazz musicians Abbey Lincoln and Max Roach crash the Security Council, Nikita Khrushchev bangs his shoe, and the U.S. State Department swings into action, sending jazz ambassador Louis Armstrong to Congo to deflect attention from the CIA-backed coup. Director Johan Grimonprez captures the moment when African politics and American jazz collided in this magnificent essay film, a riveting historical rollercoaster that illuminates the political machinations behind the 1961 assassination of Congo's leader Patrice Lumumba. Richly illustrated by eyewitness accounts, official government memos, testimonies from mercenaries and CIA operatives, speeches from Lumumba himself, and a veritable canon of jazz icons, Soundtrack to a Coup d'Etat interrogates colonial history to tell an urgent and timely story of precedent that resonates more than ever in today's geopolitical climate.","Zap Mama, In Koli Jean Bofane, Patrick Cruise O'Brien, Louis Armstrong, Andrée Blouin",Johan Grimonprez,"Daan Milius , Rémi Grellety",Johan Grimonprez,Kino Lorber,Warboys Films,,"Documentary , History , Music",French,"Nov 1, 2024, Limited",$320.5K,2h 30m,,,"Jan 7, 2025",,,,,,,
Seven Veils,78%,,"After years away, theater director Jeanine (Academy Award® nominee Amanda Seyfried) re-enters the opera world to stage her former mentor's most famous work. Haunted by dark and disturbing memories from her past, Jeanine allows her repressed trauma to color the present as her personal and professional lives begin to unravel.","Amanda Seyfried, Rebecca Liddiard, Douglas Smith, Mark O'Brien, Vinessa Antoine",Atom Egoyan,"Niv Fichman , Atom Egoyan , Simone Urdl , Kevin Krikst , Fraser Ash",Atom Egoyan,XYZ Films / Variance Films,"XYZfilms , Cinetic Media , Rhombus Media , Téléfilm Canada , Canadian Opera Company , Ego Film Arts , IPR.VC",,"Drama , Mystery & Thriller",English,"Mar 7, 2025, Limited",,1h 47m,,,,2.39:1,,,,,,
Brothers After War,,,"In Brothers After War, Jake Rademacher reconnects with his brothers and soldiers he embedded with in Iraq. He creates a unique ""then and now"" journey into the toll of war and a never before seen look at war fighters and the veterans they become.","Jake Rademacher, Isaac Rademacher, Joe Rademacher, David Paluck, Jake Rademacher",Jake Rademacher,"Jake Rademacher , Norman S. Powell",David Paluck,SDG Releasing,Perseverance Productions,R,"Documentary , War",English,"Feb 28, 2025, Limited",,1h 48m,,,,,,,,,,
The Accidental Getaway Driver,84%,,"Long (Hiệp Trần Nghĩa), a Vietnamese driver in Southern California answers a late-night call for a ride. Already in his pajamas, he reluctantly accepts, picking up a man, Tây (Dustin Nguyen), and his two companions. But the men, recently escaped convicts from an Orange County jail, take Long hostage at gunpoint, thrusting him into their getaway plan. When complications arise, the fugitives and their hostage hole up at a motel, and a tense waiting game unfolds.","Dustin Nguyen, Hiep Tran Nghia, Dali Benssalah, Phi Vu, Gabrielle Chan",Sing J. Lee,"Kimberly Steward , Basil Iwanyk , Andy Sorgie , Brendon Boyea , Joseph Hieu","Sing J. Lee , Christopher Chen",Utopia,"Thunder Road Pictures , Cedar Road , Ottocento Films , K Period Media",,"Drama , Mystery & Thriller , Crime",English,"Feb 28, 2025, Limited",,1h 42m,,,,,,,,,,
On Becoming a Guinea Fowl,100%,,"On an empty road in the middle of the night, Shula stumbles across the body of her uncle. As funeral proceedings begin around them, she and her cousins bring to light the buried secrets of their middle-class Zambian family, in filmmaker Rungano Nyoni's surreal and vibrant reckoning with the lies we tell ourselves.","Susan Chardy, Roy Chisha, Blessings Bhamjee, Chungu Bwalya, Maggie Mulubwa",Rungano Nyoni,"Ed Guiney , Andrew Lowe , Tim Cole",Rungano Nyoni,A24,"A24 , BBC Film , Element Pictures",PG-13 (Thematic Material|Sexual Abuse|Suggestive References|Some Drug Use),"Comedy , Drama",English,"Mar 7, 2025, Limited",,1h 35m,,,,,,,,,,
There's Still Tomorrow,100%,,"In this moving comedic drama set in postwar Rome, a working-class woman dreams of a better future for herself and her daughter while facing abuse at the hands of her domineering husband. When a mysterious letter arrives, she discovers the courage to change the circumstances of her life. An Italian box office phenomenon and winner of six Italian Academy Awards.","Paola Cortellesi, Valerio Mastandrea, Emanuela Fanelli, Romana Maggiora Vergano, Vinicio Marchioni",Paola Cortellesi,"Mario Gianani , Lorenzo Gangarossa","Furio Andreotti , Giulia Calenda , Paola Cortellesi",Greenwich Entertainment,"Wildside , Vision Distribution",,"Comedy , Drama , War",Italian,"Mar 7, 2025, Limited",,1h 58m,,,"Apr 8, 2025",,(1.85:1),,,,,
I Heart Willie,,,"Popular YouTubers Daniel and Nico are invited to investigate a haunted property drawn by rumors of a malevolent force. The legend centers around a boy born with deformities, resembling a human-mouse hybrid, who inspired Walt Disney's Steamboat Willie. Abused and isolated, the boy, now known as Willie, crafts a bodysuit from the skins of trespassers. Over the years, his gruesome legacy fades into folklore--until a series of disappearances sparks renewed interest. As Daniel and Nico set up for a night of thrills, they unknowingly step into a deadly game of survival.","Sergio Rogalto, Daniela Porras, Micho Camacho, Maya Luna, David Vaughn",Alejandro G. Alegre,"David Vaughn , Liz Sanchez , Arturo Rentería",David Vaughn,Rubey Entertainment,Anerke,,Horror,English,"Feb 26, 2025, Limited",,1h 28m,,,,,,,,,,
Picnic at Hanging Rock,92%,84%,"In the early 1900s, Miranda (Anne Lambert) attends a girls boarding school in Australia. One Valentine's Day, the school's typically strict headmistress (Rachel Roberts) treats the girls to a picnic field trip to an unusual but scenic volcanic formation called Hanging Rock. Despite rules against it, Miranda and several other girls venture off. It's not until the end of the day that the faculty realizes the girls and one of the teachers (Vivean Gray) have disappeared mysteriously.","Rachel Roberts, Dominic Guard, Helen Morse, Jacki Weaver, Vivean Gray",Peter Weir,Jim McElroy,,Atlantic Releasing Corporation,Australian Film Commission,PG,"Mystery & Thriller , Drama",Australian English,"Feb 2, 1979, Original",$31.2K,1h 50m,,,"Jul 21, 2009",,,"Jan 31, 2025",,,,
Bloat,,,"From a producer of Searching and Unfriended, Ben McKenzie (""Gotham"") and Bojana Novakovic (Birds of Prey) star in this chilling tale of horror and suspense. After a near-death drowning accident, a young boy's family is horrified to discover he has become possessed by a legendary demon from the depths of the lake. As the family races against time to save the boy's soul, the evil monster inside the child tears the family apart as it seeks to destroy everyone in its path.","Benjamin McKenzie, Bojana Novakovic, Malcolm Fuller, Sawyer D. Jones, Kane Kosugi",Pablo Absento,"Benjamin McKenzie , Timur Bekmambetov , Mariya Zatulovskaya",Pablo Absento,Lionsgate,"Bazelevs Entertainment , Pulsar Content",R,"Horror , Mystery & Thriller",English,"Mar 7, 2025, Limited",,1h 27m,,,"Mar 7, 2025",,,,,,,
Armand,74%,81%,"When defamed actress Elisabeth (Renate Reinsve) is abruptly called into a parent-teacher meeting after hours, she is presented with scathing allegations that trigger a tangled web of accusations between parents and faculty. As Elisabeth struggles to uncover the truth amid the empty school rooms and dark corridors, a chaotic fight for redemption arises where desire, madness and obsession prevail.","Renate Reinsve, Ellen Dorrit Petersen, Øystein Røger, Endre Hellestveit, Thea Lambrechts Vaulen",Halfdan Ullmann Tøndel,Andrea Berentsen Ottmar,Halfdan Ullmann Tøndel,IFC Films,"Film i Väst , Eye Eye Pictures , Keplerfilm",R (Sexual Material|Some Language),"Drama , Mystery & Thriller",Norwegian,"Nov 29, 2024, Limited",$105.2K,1h 56m,,,,,,,,,,
Oh Canada,65%,71%,"Fiery but feeling his years and his illness, ailing filmmaker Leonard Fife (Richard Gere) wants to tell his life story, unfiltered, before it's too late. As the director of lauded documentary exposés, he has much to be proud of, but his avoidance of the Vietnam War draft and his past relationships harbor thorny truths. Finally choosing to reveal the truth and lies in his life and career, Leonard sits for an extended filmed interview with his former student Malcolm (Michael Imperioli), charging ahead with candid stories about his younger self (Jacob Elordi) in the fractious 1960s and beyond. At Leonard's insistence, his wife and indispensable partner, Emma (Uma Thurman), hears it all. Leonard's successes are held up against his failings--the fibs held up against the facts--and as the man in full is cleansed of the myth, Leonard must confront what is left.","Richard Gere, Jacob Elordi, Uma Thurman, Michael Imperioli, Victoria Hill",Paul Schrader,"David Gonzales , Tiffany Boyle , Luisa Law , Scott LaStaiti , Meghan Hanlon",Paul Schrader,Kino Lorber,"Northern Lights , Vested Interest , Ottocento Films , Left Home",,Drama,English,"Dec 6, 2024, Limited",$194.1K,1h 35m,,Dolby Digital,"Jan 21, 2025",,,,,,,
Every Little Thing,95%,99%,"Author and rehabber Terry Masear wants to save every injured hummingbird in Los Angeles. Terry takes in the most fragile of patients through her volunteer hummingbird rescue, but the path to survival is fraught with uncertainty and drama. Over the course of Sally Aitken's intimate and moving documentary, we become invested in Terry's hummingbird patients -- including Cactus, Jimmy, Wasabi, Raisin, and Mikhail -- celebrating their small victories and lamenting their tiny tragedies. Through the eyes of America's busiest bird rehabilitator, each bird becomes memorable, mighty and heroic. As she nurtures the wounded hummingbirds back to health, Terry finds herself on her own transformative journey, unraveling a visually captivating and magical tale of love, healing, and the delicate beauty in tiny acts of greatness.","Terry Masear, Sally Aitken, Bettina Dalton, Oli Harbottle, Anna Godas",Sally Aitken,"Bettina Dalton , Oli Harbottle , Anna Godas",Sally Aitken,Kino Lorber,Wildbear Entertainment,,"Documentary , Nature",English,"Jan 10, 2025, Limited",$87.7K,1h 33m,,,"Mar 11, 2025",,,,,,,
The Visitor,,,"London, today. A refugee washes up naked in a suitcase on the bank of the Thames. The enigmatic, sexually fluid stranger introduces himself to a bourgeois, upper class family. He is invited to stay on as an employee. The Visitor soon seduces each member of the family in a series of explicit sexual encounters. He will turn their world upside down as they are able to redefine themselves in new, radical ways.","Bishop Black, Macklin Kowal, Amy Kingsmill, Ray Filar, Kurtis Lincoln",Bruce La Bruce,"Alex Babboni , Victor Fraga","Bruce La Bruce , Victor Fraga , Alex Babboni , Bruce La Bruce , Alex Babboni , Victor Fraga",Circle Collective,Apolitical,,"Comedy , Drama , LGBTQ+",English,"Mar 7, 2025, Limited",,1h 41m,,,,,,,,,,
Badnaam,,,"Following his release from prison, an outlaw with a tragic past challenges a ruthless crime boss for control of the local alcohol black market.","Jai Randhawa, Jasmin Bhasin, Mukesh Rishi, Nirmal Rishi, Vrajesh Hirjee",Maneesh Bhatt,"Gaurav Bhatia , Jag Boparai , Ravi Boparai , Jassi Lohka , Dixit Sahni , Mohit Sharma","Jassi Lohka , Siddharth-Garima",Desi Junction,"Desi Junction , JAB Studios",,"Action , Drama",Punjabi,"Feb 28, 2025, Limited",,2h 25m,,,,,,,,,,
The Annihilation of Fish,71%,99%,A woman (Lynn Redgrave) who believes a dead composer is in love with her falls in love with a man (James Earl Jones) who constantly fights an imaginary man named Hank.,"Lynn Redgrave, James Earl Jones, Margot Kidder, Paul M. Heller, William Fabrizio",Charles Burnett,"Paul M. Heller , William Fabrizio , John Remark , Eric Mitchell",,Regent Entertainment,American Sterling Productions,R,"Comedy , Drama",English,"Nov 2, 2001, Limited",$26.5K,1h 48m,,,,,,"Feb 14, 2025",,,,
The Golden Voice,,,"A homeless veteran and a young street singer, both on a self-destructive path, who battle dark times through friendship and music.","Nick Nolte, Dharon Jones, Sydney Mae Diaz, Carmen Ruby Floyd, Lenny Steinline",Brandon Eric Kamin,"Brandon Eric Kamin , Robyn K. Bennett , Andrew Greenblatt",Brandon Eric Kamin,Vertical,Bear Bear Productions,,Drama,English,"Feb 28, 2025, Limited",,1h 26m,,,,,,,,,,
Eephus,100%,,"As an imminent construction project looms over their beloved small-town baseball field, a pair of New England Sunday league teams face off for the last time over the course of a day. Tensions flare up and ceremonial laughs are shared as an era of camaraderie and escapism fades into an uncertain future.","Keith William Richards, Cliff Blake, Ray Hryb, Stephen Radochia, David Pridemore",Carson Lund,"Carson Lund , Tyler Taormina , Michael Basta , David Entin , Gabe Klinger","Michael Basta , Nate Fisher , Carson Lund",Music Box Films,Omnes Films,,"Comedy , Drama , Sports",English,"Mar 7, 2025, Limited",,1h 38m,,,,,,,,,,
The Quiet Ones,50%,100%,"In 2008, a group of men from Denmark and across Europe pulled off the biggest heist of all time on Danish soil. Kasper, a boxer with few chances left in life, is offered the opportunity to plan the robbery by its foreign initiators. At the risk of losing his family and everything that matters to him, he takes on the challenge in a bid to break all records and secure his place in the history books.","Gustav Dyekjær Giese, Reda Kateb, Amanda Collin, Christopher Wagelin, Jens Hultén",Frederik Louis Hviid,Kasper Dissing,Anders Frithiof August,Magnet Releasing,Kazak Productions,,"Action , Mystery & Thriller , Drama , History",Danish,"Feb 21, 2025, Limited",$1.4K,1h 50m,,,"Feb 21, 2025",,,,,,,
Laaj Sharanam,,,"Laaj Sharanam is a heartfelt Nepali comedy-drama that follows the intertwined lives of diverse characters in a rural community, exploring themes of love, family, and societal values. Filled with humor and emotional depth, the film captures the essence of relationships and cultural dynamics, promising an engaging and relatable cinematic experience.","Bijay Baral, Sittaram Kattel, Arjun Ghimire, Sagar Lamsal, Sitaram Kattel",Kumar Kattel,,Kumar Kattel,Nepal11 Entertainment,,,"Comedy , Drama",Nepali,"Feb 28, 2025, Limited",,2h 39m,,,,,,,,,,
Guns of Redemption,,,"A stranger known only as Luke (Casper Van Dien) is a mysterious man with a violent past. A past marked by the scars on his face and the nightmares he can't escape. He takes off his guns to find a new life. But there is no escape from a violent past. Old enemies find him and shoot him down. Before he bleeds to death, he straps his guns on one last time. With his life running out, he goes after the murderous General Bork (Jeff Fahey) to avenge the death of the Man of God (Sean Astin) who took him in, and saves Charlotte (Kaitlyn Kemp) and Anna (Siena Bjornerud), who are held captive in Bork's heinous web of evil.","Casper Van Dien, Jeff Fahey, Sean Astin, Kaitlyn Kemp, Siena Bjornerud",Brian Skiba,Jamie R. Thompson,Kieth Merrill,SHOUT! STUDIOS,"Nevermore Entertainment , Lighthouse Pictures , Cinema Europa , Skibavision , Clawfoot Productions",,"Western , Action",English,"Mar 7, 2025, Limited",,1h 38m,,,"Mar 7, 2025",,,,,,,
Unholy Song,,,"UNHOLY SONG is a skillfully executed reimagining of the greatest exorcism of all time: the Miracle of the Gerasene Swine, performed by Jesus Christ as chronicled in the New Testament. Set in modern-day Northern California, an obsessed landlord must fight to contain the demonic spirits that have been trapped inside of an audio cassette player. When his tenants unleash the evil force, it is up to their wits and the special skills of Father Bernard to cast the demons back into the bones of the swine--and forever trap the evil under the original spell.","Jessica K. Chaves, Christopher Orozco, Sean Gestl, Quint Gabriel, Eric Parkinson",Arthur G. Night,"Victor Reyes , Quint Gabriel",Arthur G. Night,Hemdale Film Corporation,Trupeak Entertainment,,"Horror , Mystery & Thriller",English,"Feb 28, 2025, Limited",,1h 27m,,,,,,,,,,
Mazaka,,,"Ramana, a devoted single father, and his son Krishna unexpectedly fall in love. Their happiness is short-lived when they realize that both women are related, stirring family opposition. As tensions rise, the two must navigate love, tradition, and tough choices that could change their lives forever.","Murli Sharma, Ajay Rao, Anshu, Ritu Varma, Sundeep Kishan",Trinadha Rao Nakkina,"Umesh Bansal , Rajesh Danda , Anil Sunkara","Prasanna Kumar Bezawada , Saikrishna",Sarigama Cinemas,"AK Entertainments , Zee Studios , Hasya Movies",,Comedy,Telugu,"Feb 25, 2025, Limited",,2h 25m,,,,,,,,,,
Is It a Crime?,,,"Helen, with her husband's blessings, rents their guest house to a business man, Derrick, and they all get more than what they bargained for.",,,,,Stonecutter Media,"Digital Seven , Juliet Echo Productions",,"Drama , Mystery & Thriller",English,"Feb 28, 2025, Limited",,1h 31m,,,,,,,,,,
We're All Gonna Die,,,"In the near future, a towering alien ""spike"" materializes in Earth's atmosphere, wreaking havoc. Years later, it's still around. A struggling beekeeper is forced to team up with an emotionally raw EMT on a roadtrip to retrieve her bees (and his car) after their stuff is suddenly teleported across the country by the alien spike.","Jordan Rodrigues, Ashly Burch, Beth May, Olivia Cade","Matthew Arnold , Freddie Wong",Adam Maffei,"Matthew Arnold , Will Campos , Beth May , Freddie Wong",RocketJump,RocketJump,R (Brief Drug Use|Language),"Comedy , Sci-Fi , Romance",English,"Mar 7, 2025, Limited",,1h 50m,,,,,,,,,,
The Stress Is Killing Me,,,"Eight friends from college get together for their 20th reunion and take a house for the week. They are all in their 40's, successful, professional. And they all hate their jobs. They reveal that they all have dream jobs they'd rather do. So for one week they decide to try their dream jobs, and it all goes hilariously wrong.","Grayson Berry, Carly Christopher, April Hartman, Theron LaFountain, Barry Landers",Tom Carroll,Eric Martinez,Tom Carroll,Freestyle Digital Media,The Stress is Killing Me,R (Language|Some Sexual Material),Comedy,English,"Feb 28, 2025, Limited",,1h 42m,,,"Mar 7, 2025",,,,,,,
Outliers and Outlaws,,100%,"Outliers and Outlaws uncovers the history of a large and vibrant lesbian community in Eugene, Oregon. Women who migrated to this small town in the 1960s-90s candidly share stories about the power of courageous and creative world-building. Intimate portraits--both then and now--model living in hard times with hope, humor, and commitment to social change. Narrated by musician Jody Bleyle (Team Dresch and Hazel). Outliers includes a rich archive of images documenting this groundbreaking community. Featured songs: ""Song of the Soul"" by Cris Williamson, ""Ode to a Gym Teacher"" by Meg Christian, and a little known ode ""Eugene, Oregon"" by Dolly Parton accompany this previously untold story.","Jody Bleyle, Judith Raiskin, Kerribeth Elliott",Courtney Hermann,Judith Raiskin,,,,,"Documentary , LGBTQ+",English,"Feb 28, 2025, Limited",,1h 0m,,,,,,,,,,
ChikiChiki BooboomBoom,,99%,"A long-awaited reunion at a farmhouse near Mumbai spirals into chaos when six friends stumble upon a dead body. Unable to call the police due to a grave mistake, they face a series of unexpected visitors, shocking discoveries, and mounting paranoia.","Swapnil Joshi, Prarthana Behere, Prajakta Mali, Prasad Khandekar, Rohit Mane",Prasad Khandekar,Sunil Narkar,"Prasad Khandekar , Prathamesh Shivalkar",Narkar Films,,,Comedy,Marathi,"Feb 28, 2025, Limited",,,,,,,,,,,,
