Anyone But You,54%,87%,"In the edgy comedy Anyone But You, Bea (Sydney Sweeney) and Ben (Glen Powell) look like the perfect couple, but after an amazing first date something happens that turns their fiery hot attraction ice cold -- until they find themselves unexpectedly thrust together at a destination wedding in Australia. So they do what any two mature adults would do: pretend to be a couple.","Sydney Sweeney, Glen Powell, Alexandra Shipp, GaTa, Hadley Robinson",Will Gluck,"Joe Roth , Jeff Kirschenbaum , Will Gluck","Ilana Wolpert , Will Gluck",Columbia Pictures,"Sony Pictures , Roth/Kirschenbaum Films , Olive Bridge Entertainment , Fifty-Fifty Films",R (Language Throughout|Brief Graphic Nudity|Sexual Content),"Romance , Comedy",English,"Feb 20, 2024",1h 43m,,,"Dec 22, 2023, Wide",$88.1M,2.39:1,,,,,,,,
It Ends With Us,54%,89%,"IT ENDS WITH US, the first Colleen Hoover novel adapted for the big screen, tells the story of Lily Bloom, a woman who overcomes a traumatic childhood to embark on a new life in Boston and chase a lifelong dream of opening her own business. A chance meeting with charming neurosurgeon Ryle Kincaid sparks an intense connection, but as the two fall deeply in love, Lily begins to see sides of Ryle that remind her of her parents’ relationship. When Lily’s first love, Atlas Corrigan, suddenly reenters her life, her relationship with Ryle is upended, and Lily realizes she must learn to rely on her own strength to make an impossible choice for her future.","Blake Lively, Justin Baldoni, Jenny Slate, Hasan Minhaj, Amy Morton",Justin Baldoni,"Alex Saks , Jamey Heath , Blake Lively , Christy Hall",Christy Hall,Columbia Pictures,"Wayfarer Studios , Saks Picture Company",PG-13 (Sexual Content|Domestic Violence|Some Strong Language),"Romance , Drama",English,"Sep 24, 2024",2h 10m,,,"Aug 9, 2024, Wide",$148.3M,2.39:1,,,,,,,,
Venom: The Last Dance,40%,80%,"In Venom: The Last Dance, Tom Hardy returns as Venom, one of Marvel's greatest and most complex characters, for the final film in the trilogy. Eddie and Venom are on the run. Hunted by both of their worlds and with the net closing in, the duo are forced into a devastating decision that will bring the curtains down on Venom and Eddie's last dance.","Tom Hardy, Chiwetel Ejiofor, Juno Temple, Alanna Ubach, Rhys Ifans",Kelly Marcel,"Avi Arad , Tom Hardy , Kelly Marcel , Hutch Parker , Amy Pascal , Matthew Tolmach",Kelly Marcel,Columbia Pictures,"Pascal Pictures , Marvel Entertainment , Matt Tolmach , Avi Arad",,"Action , Adventure , Sci-Fi",English,"Dec 10, 2024",1h 49m,,,"Oct 25, 2024, Wide",$90.0M,,,,,,,,,
Leave the World Behind,74%,36%,"In this apocalyptic thriller from award-winning writer and director Sam Esmail (Mr. Robot), Amanda (Academy Award winner Julia Roberts) and her husband Clay (Academy Award nominee Ethan Hawke), rent a luxurious home for the weekend with their kids, Archie (Charlie Evans) and Rose (Farrah Mackenzie). Their vacation is soon upended when two strangers -- G.H. (Academy Award winner Mahershala Ali) and his daughter Ruth (Myha'la) -- arrive in the night, bearing news of a mysterious cyberattack and seeking refuge in the house they claim is theirs. The two families reckon with a looming disaster that grows more terrifying by the minute, forcing everyone to come to terms with their places in a collapsing world.","Julia Roberts, Mahershala Ali, Ethan Hawke, Myha'La Herrold, Kevin Bacon",Sam Esmail,"Sam Esmail , Marisa Yeres Gill , Lisa Roberts Gillan , Chad Hamilton , Julia Roberts",Sam Esmail,Netflix,"Red Om Films , Esmail Corp. , Netflix Studios , Higher Ground Productions",R (Language|Drug Use|Brief Bloody Images|Some Sexual Content),"Mystery & Thriller , Drama",English,"Dec 8, 2023",2h 20m,Dolby Digital,,"Nov 22, 2023, Limited",,,,,,,,,,
Back in Action,28%,60%,Former CIA spies Emily and Matt are pulled back into espionage after their secret identities are exposed.,"Jamie Foxx, Cameron Diaz, McKenna Roberts, Kyle Chandler, Glenn Close",Seth Gordon,"Beau Bauman , Peter Chernin , Seth Gordon , Sharla Sumpter Bridge , Jenno Topping","Seth Gordon , Brendan O'Brien",Netflix,"Marzano Films , Good One Productions , Exhibit A , Chernin Entertainment",PG-13 (Sequences of Violence|Brief Teen Partying|Action|Some Suggestive References|Strong Language),"Action , Comedy",English,"Jan 17, 2025",1h 54m,Dolby Digital,,,,,,,,,,,,
Woman of the Hour,91%,68%,"An aspiring actress crosses paths with a prolific serial killer in '70s LA when they're cast on an episode of ""The Dating Game."" Based on a true story.","Anna Kendrick, Tony Hale, Kelley Jakle, Max Lloyd-Jones, Jedidiah Goodacre",Anna Kendrick,"Stephen Crawford , Andrew Deane , Anna Kendrick , Roy Lee , J.D. Lifshitz , Raphael Margules , Miri Yoon , Vindhya Sagar",Ian McDonald,Netflix,"AGC Studios , BoulderLight Pictures",R (Language|A Sexual Reference|Some Drug Use|Violent Content),"Crime , Drama , Mystery & Thriller",English,"Oct 18, 2024",1h 29m,Dolby Digital,,"Oct 11, 2024, Limited",,,(2.35:1),,,,,,,
His House,100%,73%,"A refugee couple makes a harrowing escape from war-torn South Sudan, but then they struggle to adjust to their new life in an English town that has an evil lurking beneath the surface.","Wunmi Mosaku, Sope Dirisu, Matt Smith, Cornell John, Emily Taaffe",Remi Weekes,"Martin Gentles , Ed King",Remi Weekes,,"BBC Films , Regency Enterprises , New Regency Pictures",,"Horror , Mystery & Thriller",British English,"Oct 30, 2020",1h 33m,,,,,,(2.35:1),,,,,,,
Sicario,92%,85%,"After rising through the ranks of her male-dominated profession, idealistic FBI agent Kate Macer receives a top assignment. Recruited by mysterious government official Matt Graver, Kate joins a task force for the escalating war against drugs. Led by the intense and shadowy Alejandro, the team travels back-and-forth across the U.S.-Mexican border, using one cartel boss to flush out a bigger one.","Emily Blunt, Benicio Del Toro, Josh Brolin, Victor Garber, Jon Bernthal",Denis Villeneuve,"Basil Iwanyk , Edward L. McDonnell , Molly Smith , Thad Luckinbill , Trent Luckinbill",Taylor Sheridan,Lionsgate Films,"Redrum , Black Label Media , Emperor Motion Pictures , Thunder Road Pictures",R (Language|Grisly Images|Strong Violence),"Mystery & Thriller , Crime , Drama , Action",English,"Dec 22, 2015",2h 1m,Dolby Digital,,"Oct 2, 2015, Wide",$46.9M,,,,,,,,,
Here,37%,58%,"Reuniting the director, writer and stars of Forrest Gump, Here is an original film about multiple families and a special place they inhabit. The story travels through generations, capturing the most relatable of human experiences. Zemeckis (Forrest Gump, Castaway, Who Framed Roger Rabbit, Contact, Back to the Future) directs from a screenplay by Eric Roth (Forrest Gump, Killers of the Flower Moon, Dune, A Star is Born) and him. Told much in the style of the acclaimed graphic novel by Richard McGuire on which it is based, Tom Hanks and Robin Wright star in a tale of love, loss, laughter and life, all of which happen right Here.","Tom Hanks, Robin Wright, Paul Bettany, Kelly Reilly, Michelle Dockery",Robert Zemeckis,"Robert Zemeckis , Derek Hogue , Jack Rapke , Bill Block","Eric Roth , Robert Zemeckis",Miramax,"Miramax , ImageMovers",PG-13,Drama,English,"Nov 26, 2024",1h 44m,"Dolby Atmos , Dolby Digital",(1.85:1),"Nov 1, 2024, Wide",$4.8M,,,,,,,,,
American Sniper,72%,84%,"U.S. Navy SEAL Chris Kyle (Bradley Cooper) takes his sole mission -- protect his comrades -- to heart and becomes one of the most lethal snipers in American history. His pinpoint accuracy not only saves countless lives but also makes him a prime target of insurgents. Despite grave danger and his struggle to be a good husband and father to his family back in the States, Kyle serves four tours of duty in Iraq. However, when he finally returns home, he finds that he cannot leave the war behind.","Bradley Cooper, Sienna Miller, Jake McDorman, Luke Grimes, Navid Negahban",Clint Eastwood,"Clint Eastwood , Robert Lorenz , Andrew Lazar , Bradley Cooper , Peter Morgan",Jason Hall,Warner Bros. Pictures,"Mad Chance , Malpaso Company , 22nd & Indiana",R (Some Sexual References|Language Throughout|Strong Disturbing War Violence),"War , Biography , Drama",English,"Apr 19, 2016",2h 12m,"Dolby Digital , Datasat , Dolby Atmos",,"Jan 16, 2015, Wide",$350.1M,,(2.35:1),,,,,,,
It's What's Inside,79%,69%,A pre-wedding reunion descends into a psychological nightmare for a group of college friends when a surprise guest arrives with a mysterious suitcase.,"Brittany O'Grady, James Morosini, Alycia Debnam-Carey, Devon Terrell, Gavin Leatherwood",Greg Jardin,"William Rosenfeld , Kate Andrews , Jason Baum , Raúl Domingo",Greg Jardin,Netflix,"Such Content , Edith Productions , Boldly Go Productions",,"Mystery & Thriller , Comedy",English,"Oct 4, 2024",1h 44m,,,,,,,,,,,,,
Annabelle,28%,35%,"John Form (Ward Horton) thinks he's found the perfect gift for his expectant wife, Mia (Annabelle Wallis) : a vintage doll in a beautiful white dress. However, the couple's delight doesn't last long: One terrible night, devil worshippers invade their home and launch a violent attack against the couple. When the cultists try to summon a demon, they smear a bloody rune on the nursery wall and drip blood on Mia's doll, thereby turning the former object of beauty into a conduit for ultimate evil.","Annabelle Wallis, Ward Horton, Tony Amendola, Alfre Woodard, Kerry O'Malley",John R. Leonetti,"Peter Safran , James Wan",Gary Dauberman,Warner Bros. Pictures,"Atomic Monster , Safran Company",R (Intense Violence and Terror),"Horror , Mystery & Thriller",English,"Feb 2, 2016",1h 38m,"Datasat , Dolby Digital",,"Oct 3, 2014, Wide",$84.4M,,,"May 7, 2025",,,,,,
Emilia Pérez,71%,16%,"From renegade auteur Jacques Audiard comes Emilia Pérez, an audacious fever dream that defies genres and expectations. Through liberating song and dance and bold visuals, this odyssey follows the journey of four remarkable women in Mexico, each pursuing their own happiness. The fearsome cartel leader Emilia (Karla Sofía Gascón) enlists Rita (Zoe Saldaña), an unappreciated lawyer stuck in a dead-end job, to help fake her death so that Emilia can finally live authentically as her true self.","Zoe Saldaña, Karla Sofía Gascón, Selena Gomez, Adriana Paz, Edgar Ramírez",Jacques Audiard,"Jacques Audiard , Valérie Schermann , Pascal Caucheteux , Anthony Vaccarello","Jacques Audiard , Thomas Bidegain",Netflix,"Les Films du Fleuve , France 2 Cinéma , Why Not Productions , Pathé , Pimienta Films , Page 114 , Logical Content Ventures",R (Sexual Material|Language|Some Violent Content),"Musical , Crime , Drama",Spanish,"Nov 13, 2024",2h 12m,,,"Nov 1, 2024, Limited",,,(2.35:1),,,,,,,
The Dark Knight,94%,94%,"With the help of allies Lt. Jim Gordon (Gary Oldman) and DA Harvey Dent (Aaron Eckhart), Batman (Christian Bale) has been able to keep a tight lid on crime in Gotham City. But when a vile young criminal calling himself the Joker (Heath Ledger) suddenly throws the town into chaos, the caped Crusader begins to tread a fine line between heroism and vigilantism.","Christian Bale, Heath Ledger, Aaron Eckhart, Michael Caine, Maggie Gyllenhaal",Christopher Nolan,"Emma Thomas , Charles Roven , Christopher Nolan","Jonathan Nolan , Christopher Nolan",Warner Bros. Pictures,"Syncopy , Legendary Entertainment , Warner Bros.",PG-13 (Some Menace|Intense Sequences of Violence),"Action , Adventure , Fantasy",English,"Jun 14, 2010",2h 32m,"DTS , Dolby Digital , SDDS",,"Jul 18, 2008, Wide",$2.0M,,(2.35:1),"Sep 15, 2023",,,,,,
Dune: Part Two,92%,95%,"""Dune: Part Two"" will explore the mythic journey of Paul Atreides as he unites with Chani and the Fremen while on a warpath of revenge against the conspirators who destroyed his family. Facing a choice between the love of his life and the fate of the known universe, he endeavors to prevent a terrible future only he can foresee.","Timothée Chalamet, Zendaya, Rebecca Ferguson, Javier Bardem, Josh Brolin",Denis Villeneuve,"Mary Parent , Cale Boyter , Denis Villeneuve , Tanya Lapointe , Patrick McCormick","Denis Villeneuve , Jon Spaihts",Warner Bros. Pictures,Legendary Pictures,PG-13 (Sequences of Strong Violence|Brief Strong Language|Some Suggestive Material),"Sci-Fi , Adventure , Action , Fantasy , Drama",English,"Apr 16, 2024",2h 46m,"Dolby Atmos , Dolby Digital",,"Mar 1, 2024, Wide",$282.0M,,,,,,,,,
Draft Day,60%,65%,"Sonny Weaver Jr. is the general manager of the Cleveland Browns. One of pro football's most important days, NFL draft day, is drawing near, but Sonny has much more on his mind than just which players to recruit. His lover is pregnant, and the team's owner wants to fire him. After Sonny accepts a deal with Seattle that nets him that team's first-round pick, he immediately wonders if he has made the right choice for himself and the Browns.","Kevin Costner, Jennifer Garner, Denis Leary, Chadwick Boseman, Frank Langella",Ivan Reitman,"Ivan Reitman , Ali Bell , Joe Medjuck","Rajiv Joseph , Scott Rothman",Lionsgate Films,"Montecito Picture Company , Odd Lot Entertainment",PG-13 (Sexual References|Brief Strong Language),Drama,English,"Aug 19, 2014",1h 49m,"Datasat , Dolby Digital",,"Apr 11, 2014, Wide",$28.8M,,,,,,,,,
UnBroken,,100%,"The daughter of a Holocaust survivor embarks on an international quest to uncover answers about the plight of her mother and her six siblings who, as mere children, escaped Nazi Germany relying solely on their own youthful bravado and the kindness of German strangers.","Beth Lane, Beth Lane, Aaron Soffin, Beth Lane, Joel Moody",Beth Lane,,"Beth Lane , Aaron Soffin",Greenwich Entertainment,"De Lamorandiere Rock Productions , MakeMake Entertainment",,"Documentary , History",English,"Feb 21, 2025",1h 37m,,,"Feb 21, 2025, Limited",,,,,,,,,,
Heat,83%,94%,"Master criminal Neil McCauley (Robert De Niro) is trying to control the rogue actions of one of his men, while also planning one last big heist before retiring. Meanwhile, Lieutenant Hanna (Al Pacino) attempts to track down McCauley as he deals with the chaos in his own life, including the infidelity of his wife (Diane Venora) and the mental health of his stepdaughter (Natalie Portman). McCauley and Hanna discover a mutual respect, even as they try to thwart each other's plans.","Al Pacino, Robert De Niro, Val Kilmer, Jon Voight, Tom Sizemore",Michael Mann,"Art Linson , Michael Mann",Michael Mann,Warner Bros.,"New Regency Productions , Warner Brothers , Regency Enterprises , Forward Pass",R,"Crime , Drama",English,"Nov 19, 2015",2h 50m,"Surround , Mono",,"Dec 15, 1995, Wide",$66.2M,,,,,,,,,
The Killer,85%,61%,"After a fateful near-miss an assassin battles his employers, and himself, on an international manhunt he insists isn't personal.","Michael Fassbender, Charles Parnell, Arliss Howard, Tilda Swinton, Kerry O'Malley",David Fincher,Ceán Chaffin,Andrew Kevin Walker,Netflix,"Plan B Entertainment , Panic Pictures (II) , Boom! Studios",R (Strong Violence|Language|Brief Sexuality),"Mystery & Thriller , Drama , Action , Adventure , Crime",English,"Nov 10, 2023",1h 58m,"Dolby Atmos , Dolby Digital",,"Oct 27, 2023, Limited",,2.39:1,,,,,,,,
Furiosa: A Mad Max Saga,90%,88%,"Snatched from the Green Place of Many Mothers, young Furiosa falls into the hands of a great biker horde led by the warlord Dementus. Sweeping through the Wasteland, they come across the Citadel, presided over by the Immortan Joe. As the two tyrants fight for dominance, Furiosa soon finds herself in a nonstop battle to make her way home.","Anya Taylor-Joy, Chris Hemsworth, Tom Burke, Alyla Browne, George Shevtsov",George Miller,"Doug Mitchell , George Miller","George Miller , Nick Lathouris",Warner Bros. Pictures,"Warner Bros. Pictures , Kennedy Miller Mitchell",R (Sequences of Strong Violence|Grisly Images),"Action , Adventure , Sci-Fi",English,"Jun 25, 2024",2h 28m,"Dolby Atmos , Dolby Digital",,"May 24, 2024, Wide",$67.4M,2.39:1,,,,,,,,
Whiplash,94%,94%,"Andrew Neiman (Miles Teller) is an ambitious young jazz drummer, in pursuit of rising to the top of his elite music conservatory. Terence Fletcher (J.K. Simmons), an instructor known for his terrifying teaching methods, discovers Andrew and transfers the aspiring drummer into the top jazz ensemble, forever changing the young man's life. But Andrew's passion to achieve perfection quickly spirals into obsession, as his ruthless teacher pushes him to the brink of his ability and his sanity.","Miles Teller, J.K. Simmons, Melissa Benoist, Paul Reiser, Austin Stowell",Damien Chazelle,"Helen Estabrook , Jason Blum , Michel Litvak , David Lancaster",Damien Chazelle,Sony Pictures Classics,"Blumhouse , Bold Films , Right of Way Films",R (Strong Language|Some Sexual References),"Drama , Music",English,"Sep 8, 2016",1h 46m,"Datasat , SDDS , Dolby Digital",,"Oct 10, 2014, Limited",$911.4K,,,,,,,,,
Oklahoma City Bombing: American Terror,,,"This gripping documentary revisits the shocking 1995 bombing of an Oklahoma City federal building, the deadliest act of domestic terrorism in US history.","Tiller Russell, Brian Lovett, Jeff Hasler",Greg Tillman,"Tiller Russell , Brian Lovett , Jeff Hasler",,Netflix,,,"Crime , Documentary",English,"Apr 18, 2025",1h 22m,,,,,,,,,,,,,
Schindler's List,98%,97%,"Businessman Oskar Schindler (Liam Neeson) arrives in Krakow in 1939, ready to make his fortune from World War II, which has just started. After joining the Nazi party primarily for political expediency, he staffs his factory with Jewish workers for similarly pragmatic reasons. When the SS begins exterminating Jews in the Krakow ghetto, Schindler arranges to have his workers protected to keep his factory in operation, but soon realizes that in so doing, he is also saving innocent lives.","Liam Neeson, Ben Kingsley, Ralph Fiennes, Caroline Goodall, Jonathan Segal",Steven Spielberg,"Branko Lustig , Gerald R. Molen , Steven Spielberg",Steven Zaillian,Universal Pictures,"Universal Pictures , Amblin Entertainment",R (Language|Actuality Violence|Some Sexuality),"History , Drama",English,"Mar 5, 2013",3h 15m,"Dolby Atmos , Stereo , Dolby Digital , DTS , Surround",,"Dec 15, 1993, Wide",$96.6M,,,"Dec 7, 2018",,,,,,
Madame Web,11%,54%,"In a switch from the typical genre, Madame Web tells the standalone origin story of one of Marvel publishing's most enigmatic heroines. The suspense-driven thriller stars Dakota Johnson as Cassandra Webb, a paramedic in Manhattan who develops the power to see the future... and realizes she can use that insight to change it. Forced to confront revelations about her past, she forges a relationship with three young women bound for powerful destinies... if they can all survive a deadly present.","Dakota Johnson, Sydney Sweeney, Celeste O'Connor, Isabela Merced, Tahar Rahim",S.J. Clarkson,Lorenzo di Bonaventura,"Matt Sazama , Burk Sharpless , Claire Parker , S.J. Clarkson",Columbia Pictures,"Di Bonaventura Pictures , TSG Entertainment",PG-13 (Violence/Action and Language),"Action , Adventure , Mystery & Thriller",English,"Mar 15, 2024",1h 56m,Dolby Atmos,,"Feb 14, 2024, Wide",$43.7M,2.39:1,,,,,,,,
The Gentlemen,75%,84%,"Mickey Pearson is an American expatriate who became rich by building a highly profitable marijuana empire in London. When word gets out that he's looking to cash out of the business, it soon triggers an array of plots and schemes -- including bribery and blackmail -- from shady characters who want to steal his domain.","Matthew McConaughey, Charlie Hunnam, Michelle Dockery, Jeremy Strong, Lyne Renee",Guy Ritchie,"Guy Ritchie , Ivan Atkinson , Bill Block",Guy Ritchie,STX Films,"CAA Media Finance , STX Films , Toff Guy Films , Miramax , Coach Films",R (Language Throughout|Drug Content|Sexual References|Violence),"Crime , Drama , Comedy",English,"Mar 24, 2020",1h 53m,"Dolby Atmos , Dolby Digital",,"Jan 24, 2020, Wide",$36.5M,2.39:1,,,,,,,,
Lucy,67%,47%,"When a boyfriend tricks Lucy (Scarlett Johansson) into delivering a briefcase to a supposed business contact, the once-carefree student is abducted by thugs who intend to turn her into a drug mule. She is surgically implanted with a package containing a powerful chemical, but it leaks into her system, giving her superhuman abilities, including telekinesis and telepathy. With her former captors in pursuit, Lucy seeks out a neurologist (Morgan Freeman), who she hopes will be able to help her.","Scarlett Johansson, Morgan Freeman, Choi Min-Sik, Amr Waked, Julian Rhind-Tutt",Luc Besson,Virginie Silla,Luc Besson,Universal Pictures,"Cine+ , EuropaCorp , Canal+ , TF1 Films Productions",R (Sexuality|Disturbing Images|Strong Violence),"Action , Mystery & Thriller , Sci-Fi",English,"May 17, 2016",1h 28m,,,"Jul 25, 2014, Wide",$126.5M,,,,,,,,,
Spider-Man: Across the Spider-Verse,95%,94%,"Miles Morales returns for the next chapter of the Oscar®-winning Spider-Verse saga, an epic adventure that will transport Brooklyn's full-time, friendly neighborhood Spider-Man across the Multiverse to join forces with Gwen Stacy and a new team of Spider-People to face off with a villain more powerful than anything they have ever encountered.","Shameik Moore, Hailee Steinfeld, Oscar Isaac","Joaquim Dos Santos , Kemp Powers , Justin K. Thompson","Christopher Miller , Phil Lord , Amy Pascal , Avi Arad , Christina Steinberg","Phil Lord , Christopher Miller , David Callaham",Columbia Pictures,"Sony Pictures Entertainment (SPE) , Lord Miller , Sony Pictures Animation , Arad Productions , Marvel Entertainment , Pascal Pictures",PG (Some Language|Animated Action Violence|Thematic Elements),"Kids & Family , Action , Adventure , Comedy , Fantasy , Animation",English,"Aug 8, 2023",2h 20m,"Dolby Digital , Dolby Atmos , SDDS",,"Jun 2, 2023, Wide",$381.2M,2.39:1,,,,,,,,
Don't Move,73%,40%,"When a killer injects her with a paralytic agent, a woman must run, fight and hide before her body completely shuts down.","Kelsey Asbille, Finn Wittrock, Daniel Francis, Dylan Beam","Adam Schindler , Brian Netto","Alex Lebovici , Sam Raimi , Zainab Azizi","T.J. Cimfel , David White",Netflix,"Hammerstone Studios , Raimi Productions , Capstone Studios",R (Language|Some Strong Violence),"Horror , Mystery & Thriller",English,"Oct 25, 2024",1h 32m,,,,,,,,,,,,,
The Mauritanian,75%,85%,"Directed by Kevin Macdonald and based on the NY Times best-selling memoir ""Guantánamo Diary"" by Mohamedou Ould Slahi, this is the inspiring true story of Slahi's fight for freedom after being detained and imprisoned without charge by the U.S. Government for years. Alone and afraid, Slahi (Tahar Rahim) finds allies in defense attorney Nancy Hollander (Jodie Foster) and her associate Teri Duncan (Shailene Woodley) who battle the U.S. government in a fight for justice that tests their commitment to the law and their client at every turn. Their controversial advocacy, along with evidence uncovered by a formidable military prosecutor, Lt. Colonel Stuart Couch (Benedict Cumberbatch), uncovers shocking truths and ultimately proves that the human spirit cannot be locked up.","Jodie Foster, Tahar Rahim, Shailene Woodley, Benedict Cumberbatch, Zachary Levi",Kevin Macdonald,"Adam Ackland , Leah Clarke , Benedict Cumberbatch , Lloyd Levin , Beatriz Levin , Mark Holder , Christine Holder , Branwen Prestwood Smith , Michael Bronner","M.B. Traven , Rory Haines , Sohrab Noshirvani",STXfilms,"Shadowplay Features , BBC Films , SunnyMarch , 30West , Topic Studios , Wonder Street , Convergent Media. , Great Point Media",R (Language|A Sexual Assault|Violence),"Drama , Mystery & Thriller",English,"Mar 2, 2021",2h 9m,,,"Feb 12, 2021, Limited",$832.4K,,,,,,,,,
The Outrun,82%,82%,"Rona, fresh out of rehab, returns to the wild Orkney Islands after more than a decade away. As she reconnects with the dramatic landscape where she grew up, memories of her childhood merge with the more recent challenging events that have set her on the path to recovery.","Saoirse Ronan, Saskia Reeves, Stephen Dillane, Lauren Lyle, Paapa Essiedu",Nora Fingscheidt,"Sarah Brocklehurst , Dominic Norris , Jack Lowden , Saoirse Ronan","Nora Fingscheidt , Daisy Lewis , Amy Liptrot , Nora Fingscheidt , Amy Liptrot",Sony Pictures Classics,"Arcade Pictures , Brock Media",R (Brief Sexuality|Language),"Drama , Biography",English,"Nov 5, 2024",1h 58m,,,"Oct 4, 2024, Limited",$865.9K,,,,,,,,,
Under the Shadow,99%,71%,"After Shideh's building is hit by a missile during the Iran-Iraq War, a superstitious neighbor suggests that the missile was cursed and might be carrying malevolent Middle-Eastern spirits. She becomes convinced a supernatural force within the building is attempting to possess her daughter Dorsa, and she has no choice but to confront these forces if she is to save her daughter and herself.","Narges Rashidi, Avin Manshadi, Bobby Naderi, Ray Haratian, Arash Marandi",Babak Anvari,"Emily Leo , Oliver Roskill , Lucan Toh",Babak Anvari,"XYZ Films , Vertical Entertainment",Wigwam Films,PG-13 (Terror|Scary Images|Brief Language),"Horror , Mystery & Thriller",Persian,"Jan 17, 2017",1h 24m,,,"Oct 7, 2016, Limited",$25.8K,,,,,,,,,
The Six Triple Eight,55%,72%,"The Six Triple Eight is inspired by the first and only Women's Army Corps unit of color to serve overseas in WWII. Despite facing racism and sexism -- and grueling working conditions -- they were committed to serving their country with honor and distinction. Given an extraordinary mission and united in their determination, these unsung heroes delivered hope and shattered barriers.","Kerry Washington, Ebony Obsidian, Milauna Jackson, Kylie Jefferson, Shanice Shantay",Tyler Perry,"Nicole Avant , Angi Bones , Tyler Perry , Keri Selig , Tony Strickland , Carlota Espinosa",Tyler Perry,Netflix,"Tyler Perry Studios , Intuition Film Productions , Netflix , Mandalay Pictures",,"Drama , War",English,"Dec 20, 2024",2h 7m,,,"Dec 6, 2024, Limited",,,,,,,,,,
