The Friend,95%,,"In The Friend, writer and teacher Iris (Naomi Watts) finds her comfortable, solitary New York life thrown into disarray after her closest friend and mentor (Bill Murray) dies suddenly and bequeaths her his beloved 150 lb. Great Dane. The regal yet intractable beast, named Apollo, immediately creates practical problems for Iris, from furniture destruction to eviction notices, as well as more existential ones, his looming presence constantly reminding her of her friend's problematic choices in both life and death. Yet as Iris finds herself unexpectedly bonding with the animal, she begins to come to terms with her past, her lost friend, and her own creative inner life.","Naomi Watts, Bill Murray, Noma Dumezweni","Scott McGehee , Stacey Battat , David Siegel","Liza Chasin , Scott McGehee , David Siegel , Mike Spreter","David Siegel , Scott McGehee",Bleecker Street,"Big Creek Projects , 3dot productions",R (A Sexual Reference|Language),"Drama , Comedy",English,"Mar 28, 2025, Limited",,2h 3m,,,,,,,,,,
Princess Mononoke,93%,94%,A prince becomes involved in the struggle between a forest princess and the encroachment of mechanization.,"Claire Danes, Billy Bob Thornton, Gillian Anderson, Billy Crudup, Minnie Driver",Hayao Miyazaki,Toshio Suzuki,"Neil Gaiman , Hayao Miyazaki",Miramax Films,"Dentsu , Nippon Herald Films , Studio Ghibli",PG-13 (Images of Violence and Gore),"Adventure , Fantasy , Anime",Japanese,"Jul 12, 1997, Original",,2h 13m,,"Dolby Digital , Dolby A , Dolby SR","Dec 16, 2019",,(1.85:1),"Mar 26, 2025",,,,
The Penguin Lessons,67%,,"Inspired by the true story of a disillusioned Englishman who went to work in a school in Argentina in 1976. Expecting an easy ride, Tom discovers a divided nation and a class of unteachable students. However, after he rescues a penguin from an oil-slicked beach, his life is turned upside-down.","Micaela Breque, Tomás Pozzi, Ramiro Blas, Steve Coogan, Björn Gustafsson",Peter Cattaneo,"Rory Aitken , Ben Pugh , Robert Walak , Adrián Guerra , Andrew Noble",Jeff Pope,Sony Pictures Classics,"42 , Nostromo Pictures",PG-13 (Some Sexual References|Thematic Elements|Strong Language),"Comedy , Drama",English,"Mar 28, 2025, Limited",,1h 50m,,,,,(1.85:1),,,,,
The Chosen: Last Supper - Part 1,,,"Jesus rides into the holy city as king, but finds his Father's house has been turned from a place of prayer into a corrupt market. As the Jewish High Priest schemes against the would-be Messiah, Jesus strikes first--turning the tables on religious corruption.","Jonathan Roumie, Shahar Isaac, Elizabeth Tabish, Paras Patel, Noah James",Dallas Jenkins,Dallas Jenkins,Dallas Jenkins,Fathom Events,5&2 Studios,,"Drama , Faith & Spirituality , History",English,"Mar 28, 2025, Limited",,2h 10m,,,,,,,,,,
Misericordia,96%,,"The teasingly entwined ambiguities of love and death continue to fascinate Alain Guiraudie (Stranger by the Lake), who returns with a sharp, sinister, yet slyly funny thriller. Set in an autumnal, woodsy village in his native region of Occitanie, his latest follows the meandering exploits of Jérémie (Félix Kysyl), an out-of-work baker who has drifted back to his hometown after the death of his beloved former boss, a bakery owner. Staying long after the funeral, the seemingly benign Jérémie begins to casually insinuate himself into his mentor's family, including his kind-hearted widow (Catherine Frot) and venomously angry son (Jean-Baptiste Durand), while making an increasingly surprising--and ultimately beneficial--friendship with an oddly cheerful local priest (Jacques Develay). In Guiraudie's quietly carnal world, violence and eroticism explode with little anticipation, and criminal behavior can seem like a natural extension of physical desire. The French director is at the top of his game in Misericordia, again upending all genre expectations.","Félix Kysyl, Catherine Frot, Jacques Develay, Jean-Baptiste Durand, David Ayala",Alain Guiraudie,Charles Gillibert,Alain Guiraudie,Sideshow / Janus Films,CG Cinéma,,"Drama , Crime",French,"Mar 21, 2025, Limited",,1h 44m,,,,,,,,,,
Secret Mall Apartment,100%,,"In 2003, eight Rhode Islanders created a secret apartment inside the busy Providence Place Mall and kept it going for four years, filming everything along the way. Far more than just a wild prank, the secret mall apartment became an incredibly meaningful act for all the participants, at once an act of defiance against local gentrification, a boundary-pushing work of public/private art, and a 750 square foot space that sticks it to the man.","Jeremy Workman, Jesse Eisenberg, Allen Altman, Cathie Altman, Matthew Spain",Jeremy Workman,Jeremy Workman,,Wheelhouse Creative,"Wheelhouse Creative , Wildbrush Media , Wrong Turn Productions",,Documentary,English,"Mar 21, 2025, Limited",,1h 31m,,,,,,,,,,
Any Day Now,,,"Steve (Taylor Gray) is a night watchman in his early 20s but his life is already getting away from him: his band is falling apart, he owes a ton of money, and he's in love with his best friend's girl. When Marty Lyons (Paul Guilfoyle) comes along and ropes Steve into a world of misfits, oddballs, and lost souls as dirty as the Charles River, Steve wonders if this is a change for the better of if he's about to make the worst mistake of his life.","Paul Guilfoyle, Taylor Gray, Alexandra Templer, Thomas Kee, Armando Rivera",Eric Aronson,"Eric Aronson , Mark Donadio , Dana Scott , Emily Sheehan",Eric Aronson,,,,"Comedy , Crime , Mystery & Thriller",English,"Mar 17, 2025, Limited",,1h 21m,,,"Mar 21, 2025",,,,,,,
Hood Witch,69%,,"HOOD WITCH follows a single mother Nour (Glshifteh Farahani) and her son. Nour makes a living from smuggling exotic animals and illicit products (birds of prey, venom, rare roots, etc.). Wishing to get her son out of the city and offer him a better future, she designs and develops a mobile app that connects clients and marabouts. It's a success, but a patient's consultation turns into a tragedy and Nour has to face a wave of violence that could cost her and her son their lives.","Golshifteh Farahani, Amine Zariouhi, Denis Lavant, Alexis Manenti, Karim Belkhadra",Saïd Belktibia,Ladj Ly,"Saïd Belktibia , Louis Penicaut",Dark Sky Films,"Lyly Films , Iconoclast Films",,"Mystery & Thriller , Action",French (France),"Mar 21, 2025, Limited",,1h 35m,(2.35:1),,"Mar 21, 2025",,,,,,,
Hans Zimmer & Friends: Diamond in the Desert,,98%,"Hans Zimmer & Friends: Diamond in the Desert captures an extraordinary live performance of some of Zimmer's most revered compositions, including music from Dune, Gladiator, Interstellar, The Lion King, and much more. Decades of cinematic masterpieces are brought to life by his band and a world-class orchestra at Dubai's iconic Coca-Cola Arena and beyond. From the dunes of the Arabian Desert, to the heights of the Burj Al Arab, these performances deliver an intimate and unique experience of Zimmer's most loved and renowned movie soundtracks. Featuring conversations with Billie Eilish, Sir Christopher Nolan, Denis Villeneuve, Finneas, Jerry Bruckheimer, Johnny Marr, Pharrell Williams, Tanya Lapointe, Timothée Chalamet and Zendaya, the film offers viewers a rare glimpse into Zimmer's creative process, exploring the drive to create and stories behind his closest collaborations. Jerry Bruckheimer serves as Executive Producer. Directed by Emmy-winning and multi Grammy-nominated Paul Dugdale, this film captures the magic and storytelling power of Zimmer's music in an unforgettable cinematic experience.","Hans Zimmer, Billie Eilish, Christopher Nolan, Denis Villeneuve, Finneas",Paul Dugdale,"Simon Fisher , Steven Kofsky , Michael Marto , Omar Saab , John Featherstone",,Trafalgar Releasing,"Jerry Bruckheimer Films , Si Fi Productions",,"Documentary , Music",English,"Mar 19, 2025, Limited",,2h 38m,,,,,,,,,,
The Ballad of Wallis Island,97%,,"THE BALLAD OF WALLIS ISLAND follows Charles (Tim Key), an eccentric lottery winner who lives alone on a remote island and dreams of getting his favorite musicians, McGwyer Mortimer (Tom Basden & Carey Mulligan) back together. His fantasy turns into reality when the bandmates and former lovers accept his invitation to play a private show at his home on Wallis Island. Old tensions resurface as Charles tries desperately to salvage his dream gig.","Tom Basden, Tim Key, Carey Mulligan, Akemnji Ndifernyan, Sian Clifford",James Griffiths,Rupert Majendie,"Tom Basden , Tim Key",Focus Features,"Moxie Pictures , Baby Cow Films",PG-13 (Some Language and Smoking),"Comedy , Drama",English,"Mar 28, 2025, Limited",,1h 40m,,,,,,,,,,
AUM: The Cult at the End of the World,70%,,"The shocking story of Aum Shinrikyo, the doomsday cult that unleashed a deadly nerve gas in Tokyo's subway system in 1995. Founded by disillusioned yoga teacher Shoko Asahara, Aum transformed into a terrorist organization while Japan's police and media turned a blind eye. Featuring rare archival footage and an interview with one of Asahara's former high-ranking disciples.","Ben Braun, Chiaki Yanagimoto, Ben Braun, Chiaki Yanagimoto","Ben Braun , Chiaki Yanagimoto","Ben Braun , Chiaki Yanagimoto , Dan Braun , Josh Braun , Rick Brookwell","Ben Braun , Chiaki Yanagimoto",Greenwich Entertainment,Submarine Deluxe,,"Documentary , Horror , Mystery & Thriller , Crime , History",English,"Mar 19, 2025, Limited",,1h 46m,,,"Mar 28, 2025",,,,,,,
Day of Reckoning,,,"On the verge of losing his wife and his job as sheriff, put-upon lawman John Dorsey reluctantly teams up with bullish U.S. Marshall Butch Hayden to hold outlaw Emily Rusk hostage. A battle of wills ensues as Emily turns the posse on themselves, but as her marauding husband and his gang approach, Emily and John realize they will need each other to survive.","Billy Zane, Zach Roerig, Cara Jade Myers, Scott Adkins, Trace Adkins",Shaun Silva,"Ali Afshar , Daniel Aspromonte , Don Lepore , Christina Moore",Travis J. Opgenorth,ESX Entertainment,,R,"Action , Western",English,"Mar 28, 2025, Limited",,1h 46m,,,,,,,,,,
A Cursed Man,,,"Documentary filmmaker Liam Le Guillou enters the world of witchcraft: and the occult, searching for an answer to the question ""is magic real?"" Seeking out some of the world's most powerful dark magic practitioners, Le Guillou will ask the unthinkable -- will they put a Curse on him. Meeting with Witches in California, Voodoo practitioners in New Orleans, Tantrics in India, and even a Satanist Shaman in Mexico, the filmmaker exposes himself to some of the world's darkest magic. On his Journey, Le Guillou meets with psychologists, and scientists studying the real world eﬀects of magic and the power of belief. As the consequences of his request begin to hit home, Le Guillou seeks out help from the very witches that warned him of his actions, forcing him to question the nature of reality in this dangerous, never-before-seen, dark social experiment.","Liam Le Guillou, Liam Le Guillou, Liam Le Guillou, Michael Steven Robbins",Liam Le Guillou,"Liam Le Guillou , Michael Steven Robbins",Liam Le Guillou,RobbinsCage,Second Shot Films,,Documentary,English,"Mar 22, 2025, Limited",,1h 37m,,,"Mar 25, 2025",,,,,,,
Midas Man,82%,80%,"Meet Brian Epstein, a man who lived a thousand lives in a few short years, a visionary who transformed music history. From running a Liverpool record store to shaping the sound of a generation, Epstein's journey is a rollercoaster of ambition, passion, and relentless pursuit of greatness. Jacob Fortune-Lloyd stars as the mastermind behind The Beatles' meteoric rise, navigating a whirlwind of unprecedented fame, cultural revolution, and personal demons. But behind the glitz and glamour lies a man seeking acceptance and love in a world not ready. Midas Man peels back the curtain on the swinging '60s, revealing the triumphs, heartbreaks, and secrets of the man who changed the face of music forever. Step into Brian's world, where every touch turns to gold, but the most precious treasure remains just out of reach.","Jacob Fortune-Lloyd, Ed Speleers, Suzy Eddie Izzard, Jay Leno, Eddie Marsan",Joe Stephenson,"Trevor Beattie , Jeremy Chatterton","Brigit Grant , Jonathan Wakeham",Menemsha Films,"Fourth Culture Films , Trevor Beattie Films , StudioPOW",,"Biography , Drama , Music",British English,"Mar 21, 2025, Limited",,2h 20m,,,,,,,,,Brigit Grant,
Viet and Nam,100%,,"In the depths of the underground coal mines, where danger awaits and darkness prevails, Nam and Việt, both young miners, cherish fleeting moments, knowing that one of them will soon leave for a new life across the sea. But the departure cannot happen as lying somewhere deep within the earth, in the far-off forest is Nam's father, a soldier, whose remains they're compelled to find. Together, following the mysteries of memories and dreams, they retrace the path to the past.","Phạm Thanh Hải, Đào Duy Bảo Định, Nguyễn Thị Nga, Lê Viết Tụng, Lê Hồ Lan",Minh Quý Trương,"Bradley Liew , Bianca Balbuena",Minh Quý Trương,Strand Releasing,"Volos Films Italia , An Original Picture , Epic Media , Deuxieme Ligne Films , Lagi Limited , E&W Films , Scarlet Visions",,"Drama , Romance , LGBTQ+",Vietnamese,"Mar 28, 2025, Limited",,2h 9m,,,,,(1.66:1),,,,,
Layla,87%,,"Layla is a struggling Arab drag queen whose confident façade hides their desperate desire for love. When their performance at a belittling corporate Pride event turns into a transgressive takedown, they are surprised to catch the eye of marketing executive Max, whose attentions sweep Layla off their feet. The two start an intoxicating romance, but as Layla starts to alter who they are in order to keep Max's interest, they both have to face uncomfortable truths.","Bilal Hasna, Louis Greatorex, Safiyya Ingar, Darkwah, Terique Jarrett",Amrou Al-Kadhi,Savannah James-Bayly,"Amrou Al-Kadhi , Amrou Al-Kadhi",Gravitas Ventures,"AUM Group , Film4 , British Film Institute",,"Comedy , Drama , Romance , LGBTQ+",English,"Mar 21, 2025, Limited",,1h 40m,,,"Mar 28, 2025",,,,,,,
Imagine Dragons: Live From the Hollywood Bowl (with the LA Film Orchestra),,,"Globally renowned, GRAMMY® Award-winning band Imagine Dragons enlisted the LA Film Orchestra to perform their biggest hits and new chart-topping songs against the backdrop of the iconic Hollywood Bowl. During a nearly two-hour concert, the band fuses their explosive, cathartic sound with gorgeous, intricate symphonic arrangements played on stage by over 50 musicians. The one night only event, captured in Fall 2024, introduced many young fans to their first ever orchestral performance and gave older fans a night never to be forgotten. The set included reimagined arrangements of Imagine Dragons staples like ""Radioactive,"" ""Demons,"" and ""Believer,"" ending with a bang as jaw-dropping fireworks crescendo into a surprise finale.",Imagine Dragons,,,,Trafalgar Releasing,,,"Documentary , Music",English,"Mar 26, 2025, Limited",,2h 0m,,,,,,,,,,
Being Maria,58%,,"Maria Schneider (Anamaria Vartolomei) is a promising, young French actress. When she gets the lead in a feature film directed by an acclaimed Italian filmmaker and starring one of America's most beloved actors, it seems like the opportunity of a lifetime. Her collaborators, director Bernardo Bertolucci and star Marlon Brando (Matt Dillon) seem to be bringing out the best in Maria, sharing a warm rapport and mentorship with the 19-year old girl. Until one day, when the two men conspire to shoot a crucial sex scene as a harrowing assault without letting Maria in on the plan. The film goes on to be lauded as a fearless artistic breakthrough, but for Maria, it’s the beginning of a living hell. Based on the behind-the-scenes true story of the making of Last Tango in Paris, Jessica Palud's sensitive biopic centers Maria's story for the first time.","Anamaria Vartolomei, Céleste Brunnquell, Giuseppe Maggio, Yvan Attal, Marie Gillain",Jessica Palud,Marielle Duigou,"Jessica Palud , Laurette Polmanss , Vanessa Schneider",Kino Lorber,Les Films de Mina,,"Biography , Drama , History",French,"Mar 21, 2025, Limited",,1h 42m,,Dolby Digital,"May 27, 2025",,(1.85:1),,,,,
Centered: Joe Lieberman,,,"From director Jonathan Gruber (Upheaval, Miriam Beerman: Expressing the Chaos, Follow Me, Life Is a Banquet), Centered: Joe Lieberman chronicles the remarkable career of Senator Joe Lieberman, a principled and bipartisan politician who navigated the tumultuous world of American politics with unwavering integrity. Lieberman, who nearly became the first Jewish Vice President of the United States, was known for putting principles and country above party. This film highlights Lieberman's extraordinary journey and 40+ years of public service. It reveals his deep commitment to the American people and serves as a timely reminder of the importance of leaders engaging in dialogue with one another--guided by civility, moderation, and a shared pursuit of unity.","Joe Lieberman, Benjamin Chavis Jr., Susan Collins, Lindsey Graham, Rep. Rosa DeLauro",Jonathan Gruber,,Jonathan Gruber,Hidden Light Institute,Hidden Light Institute,,"Documentary , Biography",English,"Mar 18, 2025, Limited",,1h 17m,,,,,,,,,,
Quisling: The Final Days,,,"Five years of occupation are over. The rebuilding of the country can begin, but first the last chapter must be written. In a cell at Akershus Fortress sits the biggest traitor Norway has ever known, Vidkun Quisling.","Gard B. Eidsvold, Anders Danielsen Lie, Lisa Carlehed, Lisa Loven Kongsli, Arthur Hakalahti",Erik Poppe,"Finn Gjerdrum , Stein B. Kvae","Anna Bache-Wiig , Ravn Lanesskog , Siv Rajendram Eliassen",Samuel Goldwyn Films,Paradox,,"Drama , History",Norwegian,"Mar 21, 2025, Limited",,2h 26m,,,"Mar 21, 2025",,,,,,,
Thank You Very Much,100%,,"A look at the all-too-short life and career of enigmatic comedy legend Andy Kaufman, including never-before-seen footage and intimate interviews with friends, colleagues and family members.","Andy Kaufman, Alex Braverman, Jenifer Westphal, Joe Plummer, Morgan Neville",Alex Braverman,"Jenifer Westphal , Joe Plummer , Morgan Neville , Caitrin Rogers",Alex Braverman,Drafthouse Films,"Wavelength Productions , Elara Pictures , Tremolo Productions",,"Biography , Documentary , Comedy",English,"Mar 28, 2025, Limited",,1h 39m,,,"Mar 28, 2025",,,,,,,
In the Summers,93%,,"Siblings Violeta and Eva live in California with their mother, but every summer they travel to Las Cruces, New Mexico, to spend time with their loving but unpredictable father, Vicente (René ""Residente"" Pérez Joglar). Over the course of four formative summers that span adolescence to early adulthood, Violeta and Eva learn to appreciate their father as a person, his flaws and limitations inseparable from his passion and tenderness. Lovers come and go, the backyard goes to seed, but the idea of home remains knotty and elusive. This powerful and deeply personal directorial debut from Alessandra Lacorazza offers a nuanced study of young people questioning their place within their families, their communities, and their identities. Winner of the US Dramatic Grand Jury Prize at Sundance, In The Summers proves both an emotional capsule of growing up within a fragmented family and a love letter to the resilience needed to survive.","Residente, Sasha Calle, Lio Mehiel, Dreya Castillo, Luciana Elisa Quinonez",Alessandra Lacorazza Samudio,"Alexander Dinelaris , Rob Quadrino , Nando Vila , Lynette Coll , Sergio Lira , Daniel Tantalean , Cynthia Fernandez De La Cruz , Jan Suter , Janek Ambros , Cristóbal Güell , Stephanie Yankwitt , Slava Vladimirov , Erick Douat",Alessandra Lacorazza Samudio,Music Box Films,"Arci Films , Bluestone Entertainment , Luz Films , Exile Content Studio , Lexicon (II) , Assembly Line Entertainment , Yellow Nest Films , 1868 Studios",,Drama,English,"Sep 20, 2024, Limited",$89.8K,1h 38m,,,"Nov 5, 2024",,(1.66:1),,,,,
Exhibition on Screen: Dawn of Impressionism - Paris 1874,,,"The Impressionists are the most popular group in art history -- millions flock every year to marvel at their masterpieces. But, to begin with, they were scorned, penniless outsiders. 1874 was the year that changed everything; the first Impressionists, ""hungry for independence"", broke the mold by holding their own exhibition outside official channels. Impressionism was born and the art world was changed forever. What led to that first groundbreaking show 150 years ago? Who were the maverick personalities that wielded their brushes in such a radical and provocative way? The spectacular Musée d'Orsay exhibition brings fresh eyes to this extraordinary tale of passion and rebellion. The story is told not only by historians and curators, but in the words of those who witnessed the dawn of Impressionism: the artists, press and people of Paris, 1874.","Phil Grabsky, Amanda Wilkie, Stephen Baysted",Ali Ray,"Phil Grabsky , Amanda Wilkie",,Seventh Art Productions,Seventh Art Productions,,"Documentary , History",English,"Mar 18, 2025, Limited",,1h 30m,,,,,,,,,,
Audrey's Children,,,"AUDREY'S CHILDREN tells the untold true story of visionary British physician Dr. Audrey Evans, who burst onto the scene in 1969 as the first female Chief of Oncology at the world-renowned Children's Hospital of Philadelphia. Battling sexism, medical conventions, and the subterfuge of her peers, Evans developed the first Neuroblastoma Staging System, co-founded the first Ronald McDonald House for families of patients, and, ultimately, impacted the lives of millions of children and families around the world.","Natalie Dormer, Jimmi Simpson, Clancy Brown, Brandon Micheal Hall, Ben Chase",Ami Canaan Mann,"Julia Fisher Farbman , Bradley Gallo , Michael A. Helfant",Julia Fisher Farbman,Blue Harbor Entertainment,"Emblem Entertainment , Resonate Entertainment , Amasia Entertainment",PG (Smoking|Thematic Content|Some Language),"Biography , Drama",English,"Mar 28, 2025, Limited",,1h 50m,,,,2.39:1,,,,,,
Holy Cow,93%,,"After the tragic death of his father, 18 year old Totone is thrust into the unexpected and very adult role of looking after his younger sister and their failing family farm in the Jura section of France. He assumes even more responsibility when he enters a cash competition for the best Comte cheese made in this western part of the French Alps. A ""verité"" look at the hardscrabble life of French agriculture, it is simultaneously a moving love story and above all an ode to the love of cheese.","Clément Faveau, Luna Garret, Mathis Bertrand, Dimitry Baudry, Maïwène Barthelemy",Louise Courvoisier,Muriel Meynard,"Louise Courvoisier , Théo Abadie",Zeitgeist Films,Ex Nihilo,,"Comedy , Drama",French,"Mar 28, 2025, Limited",,1h 30m,(2.35:1),,"Jun 3, 2025",,,,,,,
Pintu Ki Pappi,,,A man starts a lucrative business with his uncle when they realise he has a special power.,"Vijay Raaz, Ganesh Acharya, Murli Sharma, Puja Banerjee, Ali Asgar",Shiv Hare,Vidhi Acharya,"Shiv Hare , Farhad Samji , Shyamli Pandey , Anadi Sufi",Mythri Movie Makers,"Mythri Movie Makers , V2S Production & Entertainment , Ganesh Acharya Media & Entertainment",,"Romance , Comedy",Hindi,"Mar 21, 2025, Limited",,2h 15m,,,,,,,,,,
Grand Tour,89%,,"From Miguel Gomes, the award winning director of Tabu and Arabian Nights, comes a globe-trotting tale of unrequited love. Earning Gomes the Best Director prize at the 77th Cannes Film Festival, Grand Tour blends melodrama and screwball comedy in this cat-and-mouse chase between lovers. 1917, colonial Burma. Edward, a civil servant for the British Empire, jilts his lovestruck fiancée Molly the day she arrives to be married. As he escapes into an unexpected odyssey across Asia, she quickly follows suit amused by his moves. Rendered in stunning black-and-white period visuals interspersed with modern-day documentary footage, Grand Tour--Portugal's Best International Feature entry to the 97th Academy Awards®--is a dazzling multi-city symphony that will leave audiences reeling with wonder.","Crista Alfaiate, Gonçalo Waddington, Claúdio Da Silva, Lang-Khê Tran, Jorge Andrade",Miguel Gomes,"Filipa Reis , Serena Alfieire , Patricia Faria","Telmo Churro , Maureen Fazendeiro , Miguel Gomes , Babu Targino",MUBI,Uma Pedra no Sapato,,Drama,Portuguese,"Mar 28, 2025, Limited",,2h 9m,,,"Apr 18, 2025",,,,,,,
Art for Everybody,100%,,"You've seen his cozy cottages, idyllic gardens, and welcoming village streets on everything from canvas to commemorative plates. Both celebrated and disparaged for his kitschy signature settings, the ""Painter of Light"" Thomas Kinkade rocketed to popularity in the '90s by marketing himself to American evangelicals and pitting himself against the elite art establishment. Yet beneath the pristine public persona were demons that would drive him to alcoholism, scandal, and death from an overdose in 2012. After his passing, Kinkade's daughters uncovered a trove of unseen, unexpectedly dark paintings, a discovery that launched an investigation into their father's true personality. Through the voices of skeptical critics, adoring fans, and Kinkade's closest friends and family, ART FOR EVERYBODY digs deep into Kinkade's life and work to elucidate the real man behind the persona. Accomplished editor Miranda Yousef's directorial debut is an insightful documentary that peels back the layers of Kinkade's façade, delivering a portrait of a complex man divided by the same forces that continue to pull us apart as a nation.","Morgan Neville, Tim Rummel, Jessamine Burgum, Kara Durrett, Bill Way",Miranda Yousef,"Morgan Neville , Tim Rummel",,Fourth Act Film,"Whitewater Films , Fit Via Vi Film Productions , Tremolo Productions , Cinosure , The Harnisch Foundation , Pinky Promise , XRM Media",,"Documentary , Biography",English,"Mar 28, 2025, Limited",,1h 38m,,,,,,,,,,
